date,username,to,retweets,text,mentions,permalink,is Noise,clean text,text length,is null,pos_count,neg_count,related?,sentiment,system_count,services_count,reason,Date_Time
2019-11-01 19:44:52,b_m_w22122,Not given,0,وش السالفه #قاطعوا_مصرف_الراجحي,Not given,https://twitter.com/b_m_w22122/status/1190354034844209155,not noise,وش السالفه قاطعوامصرفالراجحي,28,not null,0,0,related,negative,0,0,else,2019-11-01 19:44:52
2019-11-01 19:44:47,ke_261,Not given,0,والملايين حقتي وين اوديها #قاطعوا_مصرف_الراجحي,Not given,https://twitter.com/ke_261/status/1190354015437099012,not noise,والملاين حقتي وين اوديها قاطعوامصرفالراجحي,42,not null,0,0,related,negative,0,0,else,2019-11-01 19:44:47
2019-11-01 19:44:47,sssaa105,Not given,0,أنا أحب هالبنك عشان لونه أزرق وأبيض عاش الهلال #قاطعوا_مصرف_الراجحي,Not given,https://twitter.com/sssaa105/status/1190354013272858629,not noise,انا احب هالبنك عشان لونه ازرق وابيض عاش الهلال قاطعوامصرفالراجحي,64,not null,0,0,related,positive,0,0,else,2019-11-01 19:44:47
2019-11-01 19:44:21,AlriyadhGannas,Not given,0,#قاطعوا_مصرف_الراجحي افضل بنك بالخليج من تجربه لسنوات,Not given,https://twitter.com/AlriyadhGannas/status/1190353906406178817,not noise,قاطعوامصرفالراجحي افضل بنك بالخليج من تجربه لسنوات,50,not null,1,0,related,neutral,0,0,else,2019-11-01 19:44:21
2019-11-01 19:44:20,mi_200_,Not given,0,#قاطعوا_مصرف_الراجحي مقاطعتو خلقه,Not given,https://twitter.com/mi_200_/status/1190353900639047681,not noise,قاطعوامصرفالراجحي مقاطعتو خلقه,30,not null,0,0,related,neutral,0,0,else,2019-11-01 19:44:20
2019-11-01 19:44:19,MZXvGfgYvE0CprG,Not given,0,#قاطعوا_مصرف_الراجحي انا ما ابغى اقاطعه,Not given,https://twitter.com/MZXvGfgYvE0CprG/status/1190353896662798339,not noise,قاطعوامصرفالراجحي انا ما ابغي اقاطعه,36,not null,0,0,related,neutral,0,0,else,2019-11-01 19:44:19
2019-11-01 19:44:16,ma41114,Not given,0,#قاطعوا_مصرف_الراجحي بنك في كل مكان موجود كيف نقاطعه .!,Not given,https://twitter.com/ma41114/status/1190353883832475653,not noise,قاطعوامصرفالراجحي بنك في كل مكان موجود كيف نقاطعه,50,not null,0,0,related,neutral,0,0,else,2019-11-01 19:44:16
2019-11-01 19:44:03,Fhad70707,Not given,0,#قاطعوا_مصرف_الراجحي. من انتم يوم تقاطعون ماتقدرون مافي بديل وبرج الراجحي الي على طريق الملك فهد وش وضعه فيه خزاين دراهمكم,Not given,https://twitter.com/Fhad70707/status/1190353830208319489,not noise,قاطعوامصرفالراجحي من انتم يوم تقاطعون ماتقدرون مافي بديل وبرج الراجحي الي علي طريق الملك فهد وش وضعه فيه خزاين دراهمكم,118,not null,0,0,related,negative,0,0,else,2019-11-01 19:44:03
2019-11-01 19:43:51,Asa20067,Not given,0,#قاطعوا_مصرف_الراجحي تخيلوا بعنا بيت ع عميل الممول بنك الراجحي أتفاجأ بأنه استغل شهادة السكن الاول للعميل وصرفها لحسابه وهي بالأصل حق مشروع للبائع وعندنا رقم ضريبي ورفض إرجاع المبلغ المصروف,Not given,https://twitter.com/Asa20067/status/1190353780463812608,not noise,قاطعوامصرفالراجحي تخيلوا بعنا بيت ع عميل المول بنك الراجحي اتفاجا بانه استغل شهاده السكن الاول لعميل وصرفها لحسابه وهي بالاصل حق مشروع لبائع وعندنا رقم ضريبي ورفض ارجاع المبلغ المصروف,183,not null,0,0,related,negative,0,0,else,2019-11-01 19:43:51
2019-11-01 19:43:40,_a_m95_,Not given,0,اي بنك يستقبلي بسرعه #قاطعوا_مصرف_الراجحي,Not given,https://twitter.com/_a_m95_/status/1190353735240826881,not noise,اي بنك يستقبلي بسرعه قاطعوامصرفالراجحي,38,not null,0,0,related,neutral,0,0,else,2019-11-01 19:43:40
2019-11-01 19:43:37,abuturky2030,Not given,0,#قاطعواِ_مصرف_الراجحي لن نقاطعه لانه افضل بنك وافضل مصرف وافضل خدمات الكترونيه بقارة اسيا,Not given,https://twitter.com/abuturky2030/status/1190353720149782528,not noise,قاطعواِمصرفالراجحي لن نقاطعه لانه افضل بنك وافضل مصرف وافضل خدمات الكترونيه بقاره اسيا,86,not null,1,0,related,neutral,0,0,else,2019-11-01 19:43:37
2019-11-01 19:43:07,ss9mm,Not given,0,مقاطعه منذ 15 سنه #قاطعوا_مصرف_الراجحي,Not given,https://twitter.com/ss9mm/status/1190353596338098176,not noise,مقاطعه منذ 15 سنه قاطعوامصرفالراجحي,35,not null,0,0,related,negative,0,0,else,2019-11-01 19:43:07
2019-11-01 19:42:31,3SeyeX3NKd8InC0,Not given,0,#قاطعوا_مصرف_الراجحي,Not given,https://twitter.com/3SeyeX3NKd8InC0/status/1190353443266932737,not noise,قاطعوامصرفالراجحي,17,not null,0,0,related,neutral,0,0,else,2019-11-01 19:42:31
2019-11-01 19:42:19,alnahdi_shaima,Not given,0,#قاطعوا_مصرف_الراجحي و مليياراتي فين احطها؟؟,Not given,https://twitter.com/alnahdi_shaima/status/1190353395477032961,not noise,قاطعوامصرفالراجحي و ملياراتي فين احطها,38,not null,0,0,related,negative,0,0,else,2019-11-01 19:42:19
2019-11-01 19:42:00,po_166,Not given,0,#قاطعوا_مصرف_الراجحي خرعتوني حسبت حلالي راح,Not given,https://twitter.com/po_166/status/1190353312291475456,not noise,قاطعوامصرفالراجحي خرعتوني حسبت حلالي راح,40,not null,0,0,related,negative,0,0,else,2019-11-01 19:42:00
2019-11-01 19:41:54,Mb57_K,Not given,0,تم #قاطعوا_مصرف_الراجحي,Not given,https://twitter.com/Mb57_K/status/1190353287540854787,not noise,تم قاطعوامصرفالراجحي,20,not null,0,0,related,neutral,0,0,else,2019-11-01 19:41:54
2019-11-01 19:41:42,m_al311,Not given,0,#قاطعوا_مصرف_الراجحي,Not given,https://twitter.com/m_al311/status/1190353237695770625,not noise,قاطعوامصرفالراجحي,17,not null,0,0,related,neutral,0,0,else,2019-11-01 19:41:42
2019-11-01 19:41:37,Al3almi_Pro,Not given,0,#قاطعوا_مصرف_الراجحي بالعكس افضل بنك بجانب الانماء والبلاد,Not given,https://twitter.com/Al3almi_Pro/status/1190353217911177217,not noise,قاطعوامصرفالراجحي بالعكس افضل بنك بجانب الانماء والبلاد,55,not null,1,0,related,positive,0,0,else,2019-11-01 19:41:37
2019-11-01 19:41:37,ea6BUcK7LPpDXpN,Not given,0,#قاطعوا_مصرف_الراجحي وش السبب نقاطعه كل محطه وعماره له بها صراف وكل حي له فرع افضل بنك من وجهه نظري عن البنوك الثانيه,Not given,https://twitter.com/ea6BUcK7LPpDXpN/status/1190353217353330688,not noise,قاطعوامصرفالراجحي وش السب نقاطعه كل محطه وعماره له بها صراف وكل حي له فرع افضل بنك من وجه نظري عن البنوك الثانيه,112,not null,1,0,related,negative,0,0,else,2019-11-01 19:41:37
2019-11-01 19:41:36,1i_________,Not given,0,#قاطعوا_مصرف_الراجحي وفلوسي وين اوديهن؟؟؟؟!,Not given,https://twitter.com/1i_________/status/1190353214803259392,not noise,قاطعوامصرفالراجحي وفلوسي وين اوديهن,35,not null,0,0,related,negative,0,0,else,2019-11-01 19:41:36
2019-11-01 19:41:26,MyarAimar,Not given,3,#قاطعوا_مصرف_الراجحي #دلل_زوجتك_بتغريده خلكم من الراجحي ودللوني بجواب مقنع ابكمل احفظ,Not given,https://twitter.com/MyarAimar/status/1190353172319084546,not noise,قاطعوامصرفالراجحي دلزوجتكبتغريده خلكم من الراجحي ودلوني بجواب مقنع ابكمل احفظ,77,not null,0,0,related,neutral,0,0,else,2019-11-01 19:41:26
2019-11-01 19:41:23,al_shahhrani,Not given,0,قاطعة انت مو انا صح يعاملوني كويس رغم ايقاف خدمات #قاطعوا_مصرف_الراجحي,Not given,https://twitter.com/al_shahhrani/status/1190353158347862017,not noise,قاطعه انت مو انا صح يعاملوني كويس رغم ايقاف خدمات قاطعوامصرفالراجحي,67,not null,0,0,related,negative,0,0,else,2019-11-01 19:41:23
2019-11-01 19:41:20,al_qhatani__20,Not given,1,تكلمو من بدري وجع بعد م طلع عيوني من القروض #قاطعوا_مصرف_الراجحي,Not given,https://twitter.com/al_qhatani__20/status/1190353145752412160,not noise,تكلمو من بدري وجع بعد م طلع عيوني من القروض قاطعوامصرفالراجحي,61,not null,0,0,related,negative,0,0,else,2019-11-01 19:41:20
2019-11-01 19:41:07,fgs4445,Not given,0,اذا طفشت وتذكرت القروض ورسائل الراجحي #قاطعوا_مصرف_الراجحي,Not given,https://twitter.com/fgs4445/status/1190353090949656576,not noise,اذا طفشت وتذكرت القروض ورسائل الراجحي قاطعوامصرفالراجحي,55,not null,0,0,related,negative,0,0,else,2019-11-01 19:41:07
2019-11-01 19:40:55,Bedro_11,Not given,0,معك ريالين ومسوي تاق مقاطعه ياخي خذها وانقلع #قاطعوا_مصرف_الراجحي,Not given,https://twitter.com/Bedro_11/status/1190353042975154182,not noise,معك ريالين ومسوي تاق مقاطعه ياخي خذها وانقلع قاطعوامصرفالراجحي,62,not null,0,0,related,negative,0,0,else,2019-11-01 19:40:55
2019-11-01 19:40:55,LMaY4MB3wKJXLqq,Not given,0,من افضل البنوك #قاطعوا_مصرف_الراجحي,Not given,https://twitter.com/LMaY4MB3wKJXLqq/status/1190353040576073728,not noise,من افضل البنوك قاطعوامصرفالراجحي,32,not null,1,0,related,neutral,0,0,else,2019-11-01 19:40:55
2019-11-01 19:40:22,mosafr20301,Not given,0,شو عمل #قاطعوا_مصرف_الراجحي,Not given,https://twitter.com/mosafr20301/status/1190352902457569287,not noise,شو عمل قاطعوامصرفالراجحي,24,not null,0,0,related,neutral,0,0,else,2019-11-01 19:40:22
2019-11-01 19:40:00,pearl0marble,Not given,0,مراحل جلي وتلميع الرخام تعرف على مراحل جلي البلاط والرخام قبل جلي منزلك من خلال شرح مفصل في المقالة التالية عبر الرابط ادناه:\ https://pearl-marble.com/%d8%aa%d8%b9%d8%b1%d9%81-%d8%b9%d9%84%d9%89-%d9%85%d8%b1%d8%a7%d8%ad%d9%84-%d8%ac%d9%84%d9%8a-%d8%a7%d9%84%d8%b1%d8%ae%d8%a7%d9%85/ #قاطعوا_مصرف_الراجحي,Not given,https://twitter.com/pearl0marble/status/1190352813068562433,not noise,مراحل جلي وتلميع الرخام تعرف علي مراحل جلي البلاط والرخام قبل جلي منزلك من خلال شرح مفصل في المقاله التاليه عبر الرابط ادناه قاطعوامصرفالراجحي,142,not null,0,0,related,neutral,0,0,else,2019-11-01 19:40:00
2019-11-01 19:39:48,r4iimo,Not given,0,صور الشاشه او خش الرابط وضيفيني تكفي ابغا اوصل 40مشاهده #قاطعوا_مصرف_الراجحي https://www.snapchat.com/add/xm.x89,Not given,https://twitter.com/r4iimo/status/1190352762686582786,not noise,صور الشاشه او خش الرابط وضيفيني تكفي ابغا اوصل 40مشاهده قاطعوامصرفالراجحي,74,not null,0,0,related,neutral,0,0,else,2019-11-01 19:39:48
2019-11-01 19:39:42,8gmuh45ASYlN2Kr,Not given,0,مصرف الراجحي تعامله سي جدا خاصه في استخراج بطاقه الصراف الآلي #قاطعوا_مصرف_الراجحي,Not given,https://twitter.com/8gmuh45ASYlN2Kr/status/1190352735490711552,not noise,مصرف الراجحي تعامله سي جدا خاصه في استخراج بطاقه الصراف الالي قاطعوامصرفالراجحي,79,not null,0,0,related,neutral,1,1,else,2019-11-01 19:39:42
2019-11-01 19:39:05,alhawajanobi,Not given,0,#قاطعوا_مصرف_الراجحي بكره تتم المقاطعه,Not given,https://twitter.com/alhawajanobi/status/1190352579320045569,not noise,قاطعوامصرفالراجحي بكره تم المقاطعه,34,not null,0,0,related,neutral,0,0,else,2019-11-01 19:39:05
2019-11-01 19:39:01,505Shola,Not given,0,#قاطعوا_مصرف_الراجحي ووين اودي الثلاثين ريال حقتي ؟,Not given,https://twitter.com/505Shola/status/1190352564178554880,not noise,قاطعوامصرفالراجحي وين اودي الثلاثين ريال حقتي,46,not null,0,0,related,neutral,0,0,else,2019-11-01 19:39:01
2019-11-01 19:38:49,ProfMohammedq,Not given,0,سامبا + الراجحي للأمانه في تطور الفترة الاخيرة عند الراجحي لكن لا زال هناك بنوك افضل منه بمراحل #قاطعوا_مصرف_الراجحي,Not given,https://twitter.com/ProfMohammedq/status/1190352511246487552,not noise,سامبا الراجحي لامانه في تطور الفتره الاخيره عند الراجحي لكن لا زال هناك بنوك افضل منه بمراحل قاطعوامصرفالراجحي,110,not null,1,0,related,neutral,0,0,else,2019-11-01 19:38:49
2019-11-01 19:38:48,_cc2c,Not given,0,#قاطعوا_مصرف_الراجحي,Not given,https://twitter.com/_cc2c/status/1190352507190558720,not noise,قاطعوامصرفالراجحي,17,not null,0,0,related,neutral,0,0,else,2019-11-01 19:38:48
2019-11-01 19:38:44,xgi__i,xgi__i,0,#قاطعوا_مصرف_الراجحي.,Not given,https://twitter.com/xgi__i/status/1190352490639872000,not noise,قاطعوامصرفالراجحي,17,not null,0,0,related,neutral,0,0,else,2019-11-01 19:38:44
2019-11-01 19:38:41,um_mmopp,Not given,0,. #قاطعوا_مصرف_الراجحي,Not given,https://twitter.com/um_mmopp/status/1190352480565186560,not noise,قاطعوامصرفالراجحي,18,not null,0,0,related,neutral,0,0,else,2019-11-01 19:38:41
2019-11-01 19:38:37,private455,Not given,0,#قاطعوا_مصرف_الراجحي بنك الرياض اولى بالمقاطعة,Not given,https://twitter.com/private455/status/1190352461376229376,not noise,قاطعوامصرفالراجحي بنك الرياض اولي بالمقاطعه,43,not null,0,0,related,neutral,0,0,else,2019-11-01 19:38:37
2019-11-01 19:38:22,A_h_m_a_d_555,Not given,1,#قاطعوا_مصرف_الراجحي فلوسك كم؟,Not given,https://twitter.com/A_h_m_a_d_555/status/1190352399824834563,not noise,قاطعوامصرفالراجحي فلوسك كم,26,not null,0,0,related,negative,0,0,else,2019-11-01 19:38:22
2019-11-01 19:38:09,k17kk,Not given,0,#قاطعوا_مصرف_الراجحي أكثر سؤال ضحكني هذا الأسبوع هههههههههههههههه,Not given,https://twitter.com/k17kk/status/1190352346167070720,not noise,قاطعوامصرفالراجحي اكثر سؤال ضحكني هذا الاسبوع ه,47,not null,0,0,related,neutral,0,0,else,2019-11-01 19:38:09
2019-11-01 19:38:08,aff4777,Not given,0,#قاطعوا_مصرف_الراجحي بعيد الشر عنه,Not given,https://twitter.com/aff4777/status/1190352341888880641,not noise,قاطعوامصرفالراجحي بعيد الشر عنه,31,not null,0,0,related,negative,0,0,else,2019-11-01 19:38:08
2019-11-01 19:37:56,3ASHAlmaleek,Not given,1,البنوك لابد ان تتعاون مع عملائها وتراعي مصالحهم ولايكون هو الحلقة الأضعف #قاطعوا_مصرف_الراجحي,Not given,https://twitter.com/3ASHAlmaleek/status/1190352288977752064,not noise,البنوك لابد ان تعاون مع عملائها وتراعي مصالحهم ولايكون هو الحلقه الاضعف قاطعوامصرفالراجحي,89,not null,0,0,related,negative,0,0,else,2019-11-01 19:37:56
2019-11-01 19:37:37,yuosaf712,Not given,1,#قاطعوا_مصرف_الراجحي لاحول ولاقوة الا بلله,Not given,https://twitter.com/yuosaf712/status/1190352212054204416,not noise,قاطعوامصرفالراجحي لاحول ولاقوه الا بله,38,not null,0,0,related,negative,0,0,else,2019-11-01 19:37:37
2019-11-01 19:37:29,Anwar___ak0,Not given,2,#قاطعوا_مصرف_الراجحي و الي حافي منتف مثلي شسوي,Not given,https://twitter.com/Anwar___ak0/status/1190352178873024513,not noise,قاطعوامصرفالراجحي و الي حافي منتف مثلي شسوي,43,not null,0,0,related,negative,0,0,else,2019-11-01 19:37:29
2019-11-01 19:37:26,haayyaat_432,Not given,0,#قاطعوا_مصرف_الراجحي لو قاطعناه من البديل الكفو ؟؟؟,Not given,https://twitter.com/haayyaat_432/status/1190352167204540416,not noise,قاطعوامصرفالراجحي لو قاطعناه من البديل الكفو,45,not null,1,0,related,negative,0,0,else,2019-11-01 19:37:26
2019-11-01 19:36:57,hyydy221,Not given,0,ماعندي رصيد عشان اقاطعهم #قاطعوا_مصرف_الراجحي,Not given,https://twitter.com/hyydy221/status/1190352045477449729,not noise,ماعندي رصيد عشان اقاطعهم قاطعوامصرفالراجحي,42,not null,0,0,related,negative,0,0,else,2019-11-01 19:36:57
2019-11-01 19:36:49,3z_4800,Not given,0,#قاطعوا_مصرف_الراجحي ابشر,Not given,https://twitter.com/3z_4800/status/1190352008345194497,not noise,قاطعوامصرفالراجحي ابشر,22,not null,0,0,related,neutral,0,0,else,2019-11-01 19:36:49
2019-11-01 19:36:46,marwanabuassi2,Not given,0,#قاطعوا_مصرف_الراجحي,Not given,https://twitter.com/marwanabuassi2/status/1190351999302283265,not noise,قاطعوامصرفالراجحي,17,not null,0,0,related,neutral,0,0,else,2019-11-01 19:36:46
2019-11-01 19:36:36,f5000j31,Not given,1,#قاطعوا_مصرف_الراجحي ما عندي استعدادا آبدا اقاطع مصرف الراجحي انا اشوفه افضل بنك في السعوديه,Not given,https://twitter.com/f5000j31/status/1190351955358441472,not noise,قاطعوامصرفالراجحي ما عندي استعدادا ابدا اقاطع مصرف الراجحي انا اشوفه افضل بنك في السعوديه,89,not null,1,0,related,neutral,0,0,else,2019-11-01 19:36:36
2019-11-01 19:36:32,4k5aled,Not given,0,#قاطعوا_مصرف_الراجحي صراحه تستاهلون الي يصير فيكم ماتقدر تمسك نفسك الامارة للسوء الا وتاخذ قرضك ويمسكك البنك خمس سنين برقبتك وتقول مقاطعه هههههههه حتى لو بتقاطع هو بيوقف خدماتك,Not given,https://twitter.com/4k5aled/status/1190351937172070401,not noise,قاطعوامصرفالراجحي صراحه تستاهلون الي يصير فيكم ماتقدر تمسك نفسك الاماره لسوء الا وتاخذ قرضك ويمسك البنك خمس سنين برقبتك وتقول مقاطعه ه حتي لو بتقاطع هو بيوقف خدماتك,164,not null,0,0,related,negative,0,0,else,2019-11-01 19:36:32
2019-11-01 19:36:16,h9Ffe8zfYCSN45g,Not given,0,وش عندهم بعد #قاطعوا_مصرف_الراجحي,Not given,https://twitter.com/h9Ffe8zfYCSN45g/status/1190351873150193664,not noise,وش عندهم بعد قاطعوامصرفالراجحي,30,not null,0,0,related,negative,0,0,else,2019-11-01 19:36:16
2019-11-01 19:36:07,DBAB_0580583506,Not given,0,#قاطعوا_مصرف_الراجحي,Not given,https://twitter.com/DBAB_0580583506/status/1190351831739830274,not noise,قاطعوامصرفالراجحي,17,not null,0,0,related,neutral,0,0,else,2019-11-01 19:36:07
2019-11-01 19:35:43,Moiyd20,M78AKH,0,#قاطعوا_مصرف_الراجحي عندي حسابين فيه واحتمال افتح ثالث .,Not given,https://twitter.com/Moiyd20/status/1190351734486568960,not noise,قاطعوامصرفالراجحي عندي حسابين فيه واحتمال افتح ثالث,52,not null,0,0,related,neutral,0,0,else,2019-11-01 19:35:43
2019-11-01 19:35:25,Asdf81182131,Not given,0,#قاطعوا_مصرف_الراجحي,Not given,https://twitter.com/Asdf81182131/status/1190351656740888578,not noise,قاطعوامصرفالراجحي,17,not null,0,0,related,neutral,0,0,else,2019-11-01 19:35:25
2019-11-01 19:35:23,alraahih_,Not given,0,حرام اجمل وارق مصرف تحياتي الحاره لهم وشكرامصرف الراجحي#قاطعوا_مصرف_الراجحي,Not given,https://twitter.com/alraahih_/status/1190351651107938304,not noise,حرام اجمل وارق مصرف تحياتي الحاره لهم وشكرامصرف الراجحيقاطعوامصرفالراجحي,72,not null,1,0,related,positive,0,0,else,2019-11-01 19:35:23
2019-11-01 19:35:12,ksa1_1921,Not given,0,#قاطعوا_مصرف_الراجحي,Not given,https://twitter.com/ksa1_1921/status/1190351601598435334,not noise,قاطعوامصرفالراجحي,17,not null,0,0,related,neutral,0,0,else,2019-11-01 19:35:12
2019-11-01 19:35:07,33b3,Not given,0,#قاطعوا_مصرف_الراجحي قاطعوه لحالكم ماوقف معنا الا هوو الحين تجحدون,Not given,https://twitter.com/33b3/status/1190351582514286594,not noise,قاطعوامصرفالراجحي قاطعوه لحالكم ماوقف معنا الا هو الحين تجحدون,62,not null,0,0,related,negative,0,0,else,2019-11-01 19:35:07
2019-11-01 19:35:02,saarra1001,Not given,7,#قاطعوا_مصرف_الراجحي وملياراتي وين احطها.,Not given,https://twitter.com/saarra1001/status/1190351562612334593,not noise,قاطعوامصرفالراجحي وملياراتي وين احطها,37,not null,0,0,related,negative,0,0,else,2019-11-01 19:35:02
2019-11-01 19:34:56,5HMzLHprZw3FxkH,Not given,0,افضل لانه غير موجود بليمن #قاطعوا_مصرف_الراجحي,Not given,https://twitter.com/5HMzLHprZw3FxkH/status/1190351534665748481,not noise,افضل لانه غير موجود بليمن قاطعوامصرفالراجحي,43,not null,1,0,related,negative,0,0,else,2019-11-01 19:34:56
2019-11-01 19:34:48,Kf16s2,Not given,0,#قاطعوا_مصرف_الراجحي,Not given,https://twitter.com/Kf16s2/status/1190351503481028611,not noise,قاطعوامصرفالراجحي,17,not null,0,0,related,neutral,0,0,else,2019-11-01 19:34:48
2019-11-01 19:34:38,nawaaf32,Not given,0,#قاطعوا_مصرف_الراجحي . انا بنكي #بنك_الرياض @riyadbank للأمانه ممتاز ولا عمري شفت عندهم مشكله غير نزول الراتب بفارق ساعات بسيطه عن باقي البنوك ، ومعاملتهم ممتازه جداً,@riyadbank,https://twitter.com/nawaaf32/status/1190351462435557379,not noise,قاطعوامصرفالراجحي انا بنكي بنكالرياض لامانه متاز ولا عمري شفت عندهم مشكله غير نزول الراتب بفارق ساعات بسيطه عن باقي البنوك ومعاملتهم متازه جداً,143,not null,0,0,related,neutral,0,0,else,2019-11-01 19:34:38
2019-11-01 19:34:31,alzahrani_tareq,Not given,0,#قاطعوا_مصرف_الراجحي لسنا واعيين بالمعنى الحقيقي للمقاطعة .. كلها مجرد مشاركات و تنتهي السالفة .. مصرف الراجحي يرقد و يآمن ما عنده اي مشكلة .. المقاطعات تكون بمطالبات بتخفيض نسب القروض الحالية و المطالبة بخدمات ترتقي بالمستفيد مثل بنوك خارجية ..,Not given,https://twitter.com/alzahrani_tareq/status/1190351431016026115,not noise,قاطعوامصرفالراجحي لسنا واعين بالمعني الحقيقي لمقاطعه كلها مجرد مشاركات و تنتهي السالفه مصرف الراجحي يرقد و يامن ما عنده اي مشكله المقاطعات تكون بمطالبات بتخفيض نسب القروض الحاليه و المطالبه بخدمات ترتقي بالمستفيد مثل بنوك خارجيه,229,not null,0,0,related,negative,0,0,else,2019-11-01 19:34:31
2019-11-01 19:34:01,mm_hh1212,Not given,0,يستاهل #قاطعوا_مصرف_الراجحي,Not given,https://twitter.com/mm_hh1212/status/1190351303467241473,not noise,يستاهل قاطعوامصرفالراجحي,24,not null,0,0,related,positive,0,0,else,2019-11-01 19:34:01
2019-11-01 19:34:00,5HMzLHprZw3FxkH,Not given,0,افضل لانه المصرف ميش موجود بليمن #قاطعوا_مصرف_الراجحي,Not given,https://twitter.com/5HMzLHprZw3FxkH/status/1190351303106613248,not noise,افضل لانه المصرف ميش موجود بليمن قاطعوامصرفالراجحي,50,not null,1,0,related,negative,0,0,else,2019-11-01 19:34:00
2019-11-01 19:33:29,OK3MI,Not given,0,مااقدر اقاطعه وهو اقرب فرع لي #قاطعوا_مصرف_الراجحي,Not given,https://twitter.com/OK3MI/status/1190351172298846208,not noise,ماقدر اقاطعه وهو اقرب فرع لي قاطعوامصرفالراجحي,46,not null,0,0,related,negative,0,0,else,2019-11-01 19:33:29
