date,username,to,retweets,text,mentions,permalink,is Noise,clean text,text length,is null,pos_count,neg_count,related?,sentiment,system_count,services_count,reason,Date_Time
2016-07-29 23:50:35,MajedAlrashoud,Not given,0,لا تقيسة ببنك اخر لم يتجاوز ١٠٠ فرع #رايك_في_مصرف_الراجحي,Not given,https://twitter.com/MajedAlrashoud/status/759174311433363456,not noise,لا تقيسه بنك اخر لم يتجاوز ١٠ فرع رايكفيمصرفالراجحي,51,not null,0,0,related,neutral,0,0,else,2016-07-29 23:50:35
2016-07-29 23:49:53,1Ksa00966,Not given,0,#رايك_في_مصرف_الراجحي جميع المصارف والبنوك مصاصي دماء نسبة ارباحهم اعلى,Not given,https://twitter.com/1Ksa00966/status/759174134844784640,not noise,رايكفيمصرفالراجحي جميع المصارف والبنوك مصاصي دماء نسبه ارباحهم اعلي,67,not null,0,0,related,negative,0,0,else,2016-07-29 23:49:53
2016-07-29 23:49:44,MajedAlrashoud,Not given,0,المصرف الاسلامي الوحيد الذي طبق الفرع الالي الفرع الذكي #رايك_في_مصرف_الراجحي,Not given,https://twitter.com/MajedAlrashoud/status/759174098354331648,not noise,المصرف الاسلامي الوحيد الذي طبق الفرع الالي الفرع الذكي رايكفيمصرفالراجحي,73,not null,0,0,related,neutral,0,0,else,2016-07-29 23:49:44
2016-07-29 23:49:38,kkmmoo20,Not given,0,#رايك_في_مصرف_الراجحي فرامه ضمن الفرامات الموجوده بالمملكه,Not given,https://twitter.com/kkmmoo20/status/759174073813524480,not noise,رايكفيمصرفالراجحي فرامه ضمن الفرامات الموجوده بالملكه,53,not null,0,0,related,neutral,0,0,else,2016-07-29 23:49:38
2016-07-29 23:49:27,m04j,Not given,0,#رايك_في_مصرف_الراجحي بنك متأسلم ، نجح في بداياته بسبب تجارة الوهم والصحوة,Not given,https://twitter.com/m04j/status/759174025117593601,not noise,رايكفيمصرفالراجحي بنك متاسلم نجح في بداياته بسب تجاره الوهم والصحوه,67,not null,0,0,related,negative,0,0,else,2016-07-29 23:49:27
2016-07-29 23:49:17,azaliyazaharov4,Not given,0,7x1 #سعوديات_نطالب_باسقاط_الولايه #تشفير_الدوري_السعودي #غرد_كانه_عمرك_60_سنه #رايك_في_مصرف_الراجحي,Not given,https://twitter.com/azaliyazaharov4/status/759173985334661121,not noise,7x1 سعودياتنطالباسقاطالولايه تشفيرالدوريالسعودي غردكانهعمرك60سنه رايكفيمصرفالراجحي,82,not null,0,0,related,neutral,0,0,else,2016-07-29 23:49:17
2016-07-29 23:49:16,zrlii,Not given,0,افشل بنك #رايك_في_مصرف_الراجحي,Not given,https://twitter.com/zrlii/status/759173980372733952,not noise,افشل بنك رايكفيمصرفالراجحي,26,not null,0,1,related,neutral,0,0,else,2016-07-29 23:49:16
2016-07-29 23:49:13,MajedAlrashoud,Not given,0,فروعه تجاوزت ال٥٠٠ فرع وصرافاته الالية تجاوزت الاربعة الاف جهاز صراف الي #رايك_في_مصرف_الراجحي,Not given,https://twitter.com/MajedAlrashoud/status/759173967638831104,not noise,فروعه تجاوزت ال٥٠ فرع وصرافاته الاليه تجاوزت الاربعه الاف جهاز صراف الي رايكفيمصرفالراجحي,89,not null,2,0,related,neutral,0,0,else,2016-07-29 23:49:13
2016-07-29 23:48:22,mrshukr999,Not given,0,اما الان اصبح الجميع يقترض لكي يكون كالاخرين ، مد ارجولك على قد قرضك ، مفارقات عجيبة . #رايك_في_مصرف_الراجحي,Not given,https://twitter.com/mrshukr999/status/759173754979250176,not noise,اما الان اصبح الجميع يقترض لكي يكون كالاخرين مد ارجولك علي قد قرضك مفارقات عجيبه رايكفيمصرفالراجحي,98,not null,0,0,related,negative,0,0,else,2016-07-29 23:48:22
2016-07-29 23:47:58,A_H_K67,Not given,0,#رايك_في_مصرف_الراجحي احسن مافيه فلوس صرافاته جديدة ههههههههههههه,Not given,https://twitter.com/A_H_K67/status/759173654118817792,not noise,رايكفيمصرفالراجحي احسن مافيه فلوس صرافاته جديده ه,49,not null,0,0,related,neutral,0,0,else,2016-07-29 23:47:58
2016-07-29 23:47:56,hbhb1010,Not given,0,مش ولا بد #رايك_في_مصرف_الراجحي,Not given,https://twitter.com/hbhb1010/status/759173647206584321,not noise,مش ولا بد رايكفيمصرفالراجحي,27,not null,0,0,related,neutral,0,0,else,2016-07-29 23:47:56
2016-07-29 23:47:55,_s_s_i,Not given,0,#رايك_في_مصرف_الراجحي لحد يسبهم مابقى شي على الراتب,Not given,https://twitter.com/_s_s_i/status/759173641313583104,not noise,رايكفيمصرفالراجحي لحد يسبهم مابقي شي علي الراتب,47,not null,0,0,related,negative,0,0,else,2016-07-29 23:47:55
2016-07-29 23:47:26,MajedAlrashoud,Not given,0,المصرف الاكبر والوحيد في العالم الاسلامي #رايك_في_مصرف_الراجحي,Not given,https://twitter.com/MajedAlrashoud/status/759173519708127233,not noise,المصرف الاكبر والوحيد في العالم الاسلامي رايكفيمصرفالراجحي,58,not null,0,0,related,neutral,0,0,else,2016-07-29 23:47:26
2016-07-29 23:47:25,Hatim56HFC,Not given,0,اسوأ بنك في المجموعه الشمسيه #رايك_في_مصرف_الراجحي,Not given,https://twitter.com/Hatim56HFC/status/759173514750484481,not noise,اسوا بنك في المجموعه الشمسيه رايكفيمصرفالراجحي,46,not null,0,0,related,neutral,0,0,else,2016-07-29 23:47:25
2016-07-29 23:47:15,mimiksa1,Not given,1,#رايك_في_مصرف_الراجحي لحيةٍ غانمه,Not given,https://twitter.com/mimiksa1/status/759173471758905346,not noise,رايكفيمصرفالراجحي لحيهٍ غانمه,29,not null,0,0,related,neutral,0,0,else,2016-07-29 23:47:15
2016-07-29 23:47:12,mrshukr999,Not given,0,البنوك كافك بسبب اغراق البلد بالقروض ادت الى إغراق المواطنين بالديون ، في السابق كان الناس عايشين على قدهم ... يتبع #رايك_في_مصرف_الراجحي,Not given,https://twitter.com/mrshukr999/status/759173462976004097,not noise,البنوك كافك بسب اغراق البلد بالقروض ادت الي اغراق المواطنين بالديون في السابق كان الناس عايشين علي قدهم يتبع رايكفيمصرفالراجحي,126,not null,0,0,related,negative,0,0,else,2016-07-29 23:47:12
2016-07-29 23:47:02,ofs555,Not given,0,#رايك_في_مصرف_الراجحي خايس وبقوه,Not given,https://twitter.com/ofs555/status/759173417329451008,not noise,رايكفيمصرفالراجحي خايس وبقوه,28,not null,0,0,related,positive,0,0,else,2016-07-29 23:47:02
2016-07-29 23:46:57,saudJam,Not given,0,فاشل #رايك_في_مصرف_الراجحي,Not given,https://twitter.com/saudJam/status/759173396869615616,not noise,فاشل رايكفيمصرفالراجحي,22,not null,0,0,related,negative,0,0,else,2016-07-29 23:46:57
2016-07-29 23:46:49,_1zio,Not given,0,#رايك_في_مصرف_الراجحي زي الخرا,Not given,https://twitter.com/_1zio/status/759173364858621952,not noise,رايكفيمصرفالراجحي زي الخرا,26,not null,0,0,related,negative,0,0,else,2016-07-29 23:46:49
2016-07-29 23:45:49,majd98891407,Not given,0,زي الخراء #رايك_في_مصرف_الراجحي,Not given,https://twitter.com/majd98891407/status/759173113515012096,not noise,زي الخراء رايكفيمصرفالراجحي,27,not null,0,0,related,negative,0,0,else,2016-07-29 23:45:49
2016-07-29 23:45:44,so8866,Not given,0,يشفطونك شفط لين تموت وإذ مت غسلوك وكفنوك مجاني وصلوا عليك في جامع الراجحي #رايك_في_مصرف_الراجحي,Not given,https://twitter.com/so8866/status/759173091213926400,not noise,يشفطونك شفط لين تموت واذ مت غسلوك وكفنوك مجاني وصلوا عليك في جامع الراجحي رايكفيمصرفالراجحي,91,not null,0,0,related,negative,0,0,else,2016-07-29 23:45:44
2016-07-29 23:45:26,al7urf,Not given,0,#رايك_في_مصرف_الراجحي مصرف زباله ضاحك ع الناس بالشرعيه وهي بريئة منه,Not given,https://twitter.com/al7urf/status/759173016043552768,not noise,رايكفيمصرفالراجحي مصرف زباله ضاحك ع الناس بالشرعيه وهي بريئه منه,64,not null,0,0,related,negative,0,0,else,2016-07-29 23:45:26
2016-07-29 23:45:03,mouhmed1701,Not given,0,سيء للغاية #رايك_في_مصرف_الراجحي,Not given,https://twitter.com/mouhmed1701/status/759172921759850496,not noise,سيء لغايه رايكفيمصرفالراجحي,27,not null,0,1,related,neutral,0,0,else,2016-07-29 23:45:03
2016-07-29 23:44:54,aalthaiban9596,Not given,0,#رايك_في_مصرف_الراجحي يشفط جيوب عملائه ع الطريقه الإسلاميه.,Not given,https://twitter.com/aalthaiban9596/status/759172882186530816,not noise,رايكفيمصرفالراجحي يشفط جيوب عملائه ع الطريقه الاسلاميه,54,not null,0,0,related,negative,0,0,else,2016-07-29 23:44:54
2016-07-29 23:44:52,waqai_24,Not given,0,#رايك_في_مصرف_الراجحي من أكثر البنوك جشعاً وإستغلالً للمواطن ومن أكثرها أخذً للفائدة ع القروض ..,Not given,https://twitter.com/waqai_24/status/759172875341467648,not noise,رايكفيمصرفالراجحي من اكثر البنوك جشعاً واستغلالً لمواطن ومن اكثرها اخذً لفائده ع القروض,88,not null,0,0,related,negative,0,0,else,2016-07-29 23:44:52
2016-07-29 23:44:40,jjhhmmoo8,Not given,0,خاااايس #رايك_في_مصرف_الراجحي,Not given,https://twitter.com/jjhhmmoo8/status/759172824149987328,not noise,خايس رايكفيمصرفالراجحي,22,not null,0,0,related,neutral,0,0,else,2016-07-29 23:44:40
2016-07-29 23:44:10,vib111184,Not given,0,#رايك_في_مصرف_الراجحي عندهم فلوس واجد,Not given,https://twitter.com/vib111184/status/759172697326809088,not noise,رايكفيمصرفالراجحي عندهم فلوس واجد,33,not null,0,0,related,neutral,0,0,else,2016-07-29 23:44:10
2016-07-29 23:43:49,altwyjire,Not given,2,#رايك_في_مصرف_الراجحي كثرة فروعه وصرافاته وسهولة خدماته الإلكترونية تجعلني أغظ الطرف عن كافة عيوبه,Not given,https://twitter.com/altwyjire/status/759172608139100160,not noise,رايكفيمصرفالراجحي كثره فروعه وصرافاته وسهوله خدماته الالكترونيه تجعلني اغظ الطرف عن كافه عيوبه,94,not null,2,0,related,neutral,0,0,else,2016-07-29 23:43:49
2016-07-29 23:43:35,ff999s1,Not given,0,#رايك_في_مصرف_الراجحي يعتبر أفضل الأسوء..!!,Not given,https://twitter.com/ff999s1/status/759172551381753856,not noise,رايكفيمصرفالراجحي يعتبر افضل الاسوء,35,not null,1,1,related,positive,0,0,else,2016-07-29 23:43:35
2016-07-29 23:43:00,falcon958,Not given,0,خدمات الكترونية تلامس الكمال موظفون تحت النعال #رايك_في_مصرف_الراجحي,Not given,https://twitter.com/falcon958/status/759172402446213120,not noise,خدمات الكترونيه تلامس الكمال موظفون تحت النعال رايكفيمصرفالراجحي,64,not null,0,0,related,neutral,0,0,else,2016-07-29 23:43:00
2016-07-29 23:42:42,saloo7ah85,Not given,0,#رايك_في_مصرف_الراجحي أحبه,Not given,https://twitter.com/saloo7ah85/status/759172326823002112,not noise,رايكفيمصرفالراجحي احبه,22,not null,0,0,related,positive,0,0,else,2016-07-29 23:42:42
2016-07-29 23:42:38,vetsh1,Not given,0,#رايك_في_مصرف_الراجحي مش كويس,Not given,https://twitter.com/vetsh1/status/759172312180588545,not noise,رايكفيمصرفالراجحي مش كويس,25,not null,0,0,related,neutral,0,0,else,2016-07-29 23:42:38
2016-07-29 23:42:36,saloo7ah85,Not given,0,#رايك_في_مصرف_الراجحي غثيث بس مافي غنى عنه,Not given,https://twitter.com/saloo7ah85/status/759172303745847296,not noise,رايكفيمصرفالراجحي غثيث بس مافي غني عنه,38,not null,0,0,related,positive,0,0,else,2016-07-29 23:42:36
2016-07-29 23:41:45,9090Wx,Not given,0,#رايك_في_مصرف_الراجحي خانق الناس كذا,Not given,https://twitter.com/9090Wx/status/759172090536886273,not noise,رايكفيمصرفالراجحي خانق الناس كذا,32,not null,0,0,related,negative,0,0,else,2016-07-29 23:41:45
2016-07-29 23:41:43,ahmadalmalke,Not given,0,#رايك_في_مصرف_الراجحي سيء وجيد ومقبول,Not given,https://twitter.com/ahmadalmalke/status/759172082278203392,not noise,رايكفيمصرفالراجحي سيء وجيد ومقبول,33,not null,0,1,related,positive,0,0,else,2016-07-29 23:41:43
2016-07-29 23:41:40,Zxc561311,Not given,0,بنك مزعج #رايك_في_مصرف_الراجحي,Not given,https://twitter.com/Zxc561311/status/759172066675417089,not noise,بنك مزعج رايكفيمصرفالراجحي,26,not null,0,0,related,neutral,0,0,else,2016-07-29 23:41:40
2016-07-29 23:41:31,moh151_,Not given,0,كل الشعب يشتكون من البنك شسالفه . #رايك_في_مصرف_الراجحي,Not given,https://twitter.com/moh151_/status/759172029543251968,not noise,كل الشعب يشتكون من البنك شسالفه رايكفيمصرفالراجحي,49,not null,0,0,related,negative,0,0,else,2016-07-29 23:41:31
2016-07-29 23:41:29,S3__sh,Not given,0,بالنسبه للبنوك الثانيه اهونها #رايك_في_مصرف_الراجحي,Not given,https://twitter.com/S3__sh/status/759172020814942209,not noise,بالنسبه لبنوك الثانيه اهونها رايكفيمصرفالراجحي,46,not null,0,0,related,neutral,0,0,else,2016-07-29 23:41:29
2016-07-29 23:41:26,arwa_sy,Not given,0,اتعس بنك في الحياة #رايك_في_مصرف_الراجحي,Not given,https://twitter.com/arwa_sy/status/759172010534731776,not noise,اتعس بنك في الحياه رايكفيمصرفالراجحي,36,not null,0,0,related,neutral,0,0,else,2016-07-29 23:41:26
2016-07-29 23:41:21,melano87me,Not given,0,تعبان #رايك_في_مصرف_الراجحي,Not given,https://twitter.com/melano87me/status/759171989500207104,not noise,تعبان رايكفيمصرفالراجحي,23,not null,0,0,related,neutral,0,0,else,2016-07-29 23:41:21
2016-07-29 23:41:10,q_saud,Not given,0,#رايك_في_مصرف_الراجحي مثل ( البقاله ) الفرق انه يآخذ منك دون مقابل,Not given,https://twitter.com/q_saud/status/759171941475418112,not noise,رايكفيمصرفالراجحي مثل البقاله الفرق انه ياخذ منك دون مقابل,58,not null,0,0,related,negative,0,0,else,2016-07-29 23:41:10
2016-07-29 23:40:20,me_mei_00,Not given,2,#رايك_في_مصرف_الراجحي شر لابد منه,Not given,https://twitter.com/me_mei_00/status/759171732238430209,not noise,رايكفيمصرفالراجحي شر لابد منه,29,not null,0,0,related,positive,0,0,else,2016-07-29 23:40:20
2016-07-29 23:40:06,abubadralfaiz,Not given,0,انتشر انتشارًا لم يستوعبه.. وكسب ثقة لم يقدّرها !! (أقوله إجمالًا رغم بعض محاسنه). #رايك_في_مصرف_الراجحي,Not given,https://twitter.com/abubadralfaiz/status/759171675426525189,not noise,انتشر انتشارًا لم يستوعبه وكسب ثقه لم يقدّرها اقوله اجمالًا رغم بعض محاسنه رايكفيمصرفالراجحي,92,not null,0,0,related,positive,0,0,else,2016-07-29 23:40:06
2016-07-29 23:39:50,yazeedmohammed_,Not given,0,ميزته وقت نزول الرواتب يعطلون عليك الصرافات وتكون خارج الخدمة #رايك_في_مصرف_الراجحي,Not given,https://twitter.com/yazeedmohammed_/status/759171608561016833,not noise,ميزته وقت نزول الرواتب يعطلون عليك الصرافات وتكون خارج الخدمه رايكفيمصرفالراجحي,79,not null,0,0,related,neutral,2,2,else,2016-07-29 23:39:50
2016-07-29 23:39:35,leon_0o,leon_0o,0,تفعيل مستفيد في بنك محلي يستدعي الحضور في المصرف، لا يوجد ما يستدعي ذلك #رايك_في_مصرف_الراجحي,Not given,https://twitter.com/leon_0o/status/759171545705095168,not noise,تفعيل مستفيد في بنك محلي يستدعي الحضور في المصرف لا يوجد ما يستدعي ذلك رايكفيمصرفالراجحي,88,not null,0,0,related,neutral,0,0,else,2016-07-29 23:39:35
2016-07-29 23:39:30,norah__hfc1,Not given,0,#رايك_في_مصرف_الراجحي اخس بنك خدمات وموظفين.,Not given,https://twitter.com/norah__hfc1/status/759171522997186560,not noise,رايكفيمصرفالراجحي اخس بنك خدمات وموظفين,39,not null,0,0,related,negative,0,0,else,2016-07-29 23:39:30
2016-07-29 23:39:23,sami_alruhaili,Not given,0,يحسسونك بعض الناس انه لازم يكون بكرت العايله يستغرب منك اذا قلتله ماعندي حساب بالراجحي تحس انك متخلف من ردة فعله #رايك_في_مصرف_الراجحي,Not given,https://twitter.com/sami_alruhaili/status/759171495801262080,not noise,يحسونك بعض الناس انه لازم يكون بكرت العايله يستغرب منك اذا قلتله ماعندي حساب بالراجحي تحس انك متخلف من رده فعله رايكفيمصرفالراجحي,129,not null,0,0,related,negative,0,0,else,2016-07-29 23:39:23
2016-07-29 23:39:22,a_albekiri,Not given,2,#رايك_في_مصرف_الراجحي احسن مافيهم ان الواحد اذا توفى يسقط عنه الدين,Not given,https://twitter.com/a_albekiri/status/759171488692002817,not noise,رايكفيمصرفالراجحي احسن مافيهم ان الواحد اذا توفي يسقط عنه الدين,63,not null,0,0,related,negative,0,0,else,2016-07-29 23:39:22
2016-07-29 23:39:09,Abdullahalsha30,Not given,0,أسوأ بنك في السعوديه #رايك_في_مصرف_الراجحي,Not given,https://twitter.com/Abdullahalsha30/status/759171436527443968,not noise,اسوا بنك في السعوديه رايكفيمصرفالراجحي,38,not null,0,0,related,neutral,0,0,else,2016-07-29 23:39:09
2016-07-29 23:38:38,Liaf111,Not given,0,#رايك_في_مصرف_الراجحي ودي احش بس حرام قطع الارزاق وبنسبه لي أحط فلوسي في تنكه ولا اضعها فيه .,Not given,https://twitter.com/Liaf111/status/759171307032481792,not noise,رايكفيمصرفالراجحي ودي احش بس حرام قطع الارزاق وبنسبه لي احط فلوسي في تنكه ولا اضعها فيه,88,not null,0,0,related,negative,0,0,else,2016-07-29 23:38:38
2016-07-29 23:38:24,ahmed40014001,Not given,0,#رايك_في_مصرف_الراجحي زباله,Not given,https://twitter.com/ahmed40014001/status/759171247532015616,not noise,رايكفيمصرفالراجحي زباله,23,not null,0,0,related,negative,0,0,else,2016-07-29 23:38:24
2016-07-29 23:38:11,aburashed1980,Not given,0,#رايك_في_مصرف_الراجحي مفروض اسمه مصرف ابو فراج دايم فارجه قرض وجسر وسيارة وبيت,Not given,https://twitter.com/aburashed1980/status/759171191399714816,not noise,رايكفيمصرفالراجحي مفروض اسمه مصرف ابو فراج دايم فارجه قرض وجسر وسياره وبيت,74,not null,0,0,related,neutral,0,0,else,2016-07-29 23:38:11
2016-07-29 23:38:05,a07albarqi,Not given,0,#رايك_في_مصرف_الراجحي بنك ربوي,Not given,https://twitter.com/a07albarqi/status/759171167227875328,not noise,رايكفيمصرفالراجحي بنك ربوي,26,not null,0,0,related,neutral,0,0,else,2016-07-29 23:38:05
2016-07-29 23:38:03,nor_sob,nor_sob,0,#رايك_في_مصرف_الراجحي مايقارن في بنك الجزيره نهائيا,Not given,https://twitter.com/nor_sob/status/759171158113738752,not noise,رايكفيمصرفالراجحي مايقارن في بنك الجزيره نهائيا,47,not null,0,0,related,neutral,0,0,else,2016-07-29 23:38:03
2016-07-29 23:37:23,msha987,Not given,0,أفضل السيئين وأكثرهم توفير للخدمات #رايك_في_مصرف_الراجحي,Not given,https://twitter.com/msha987/status/759170990693838849,not noise,افضل السيئين واكثرهم توفير لخدمات رايكفيمصرفالراجحي,51,not null,1,2,related,positive,0,0,else,2016-07-29 23:37:23
2016-07-29 23:36:56,qvq9999,Not given,0,#رايك_في_مصرف_الراجحي بنگ حرامي بطريقه مهذبه .,Not given,https://twitter.com/qvq9999/status/759170876512280576,not noise,رايكفيمصرفالراجحي بنك حرامي بطريقه مهذبه,41,not null,0,0,related,negative,0,0,else,2016-07-29 23:36:56
2016-07-29 23:36:43,faris_ff22,Not given,0,#رايك_في_مصرف_الراجحي كل المصارف يبي لها شغل أرباح وليس لهم اي دور اجتماعي,Not given,https://twitter.com/faris_ff22/status/759170824410689537,not noise,رايكفيمصرفالراجحي كل المصارف يبي لها شغل ارباح وليس لهم اي دور اجتماعي,70,not null,0,0,related,neutral,0,0,else,2016-07-29 23:36:43
2016-07-29 23:36:40,vip61113,Not given,1,بنك فخم وافضل بنك ف العالم اي اعتراض يكلمني #رايك_في_مصرف_الراجحي,Not given,https://twitter.com/vip61113/status/759170811441930240,not noise,بنك فخم وافضل بنك ف العالم اي اعتراض يكلمني رايكفيمصرفالراجحي,61,not null,2,0,related,positive,0,0,else,2016-07-29 23:36:40
2016-07-29 23:36:25,monaa4455,Not given,0,اسوء مكان يتم خدمتك فيها باختصار هو وstc &lt; لازم تدخل بالسالفه #رايك_في_مصرف_الراجحي,Not given,https://twitter.com/monaa4455/status/759170747755552768,not noise,اسوء مكان يتم خدمتك فيها باختصار هو وstc lt لازم تدخل بالسالفه رايكفيمصرفالراجحي,80,not null,0,1,related,negative,0,0,else,2016-07-29 23:36:25
2016-07-29 23:36:20,9alalmi9,Not given,0,اسوء السيئين #رايك_في_مصرف_الراجحي,Not given,https://twitter.com/9alalmi9/status/759170728067489792,not noise,اسوء السيئين رايكفيمصرفالراجحي,30,not null,0,3,related,negative,0,0,else,2016-07-29 23:36:20
2016-07-29 23:35:53,SalehAlQhatani,Not given,0,#رايك_في_مصرف_الراجحي سيء جدا حولت مبلغ عن طريقة إلى بريطانيا وبعد شهر وتأخير رجع المبلغ ناقص بدون أي إحترام للعميل ..,Not given,https://twitter.com/SalehAlQhatani/status/759170614599049216,not noise,رايكفيمصرفالراجحي سيء جدا حولت مبلغ عن طريقه الي بريطانيا وبعد شهر وتاخير رجع المبلغ ناقص بدون اي احترام لعميل,111,not null,0,1,related,negative,0,0,else,2016-07-29 23:35:53
2016-07-29 23:35:43,akawe27,Not given,0,من تشوف شعارهم تغسل يدك #رايك_في_مصرف_الراجحي,Not given,https://twitter.com/akawe27/status/759170571431206912,not noise,من تشوف شعارهم تغسل يدك رايكفيمصرفالراجحي,41,not null,0,0,related,positive,0,0,else,2016-07-29 23:35:43
2016-07-29 23:35:15,veviasla,Not given,0,#رايك_في_مـصرف_الراجحي بنك نفس البنوك ثاني مافيه بنك في السعوديه جميع البنوك في السعوديه ضحيتهم المواطن,Not given,https://twitter.com/veviasla/status/759170453298708480,not noise,رايكفيمصرفالراجحي بنك نفس البنوك ثاني مافيه بنك في السعوديه جميع البنوك في السعوديه ضحيتهم المواطن,98,not null,0,0,related,negative,0,0,else,2016-07-29 23:35:15
2016-07-29 23:35:11,sahoooma2,Not given,0,رغم مداخيلهم الكبيرة الا ان خدماتهم سيئة #رايك_في_مصرف_الراجحي,Not given,https://twitter.com/sahoooma2/status/759170438912176132,not noise,رغم مداخيلهم الكبيره الا ان خدماتهم سيئه رايكفيمصرفالراجحي,58,not null,0,1,related,negative,0,0,else,2016-07-29 23:35:11
2016-07-29 23:35:09,aswar_9000,Not given,0,#رايك_في_مصرف_الراجحي شر لابد منه,Not given,https://twitter.com/aswar_9000/status/759170427084210176,not noise,رايكفيمصرفالراجحي شر لابد منه,29,not null,0,0,related,positive,0,0,else,2016-07-29 23:35:09
2016-07-29 23:35:07,shaibashrene,Not given,0,#رايك_في_مصرف_الراجحي مابوه مثله ابد,Not given,https://twitter.com/shaibashrene/status/759170419115061248,not noise,رايكفيمصرفالراجحي مابوه مثله ابد,32,not null,0,0,related,positive,0,0,else,2016-07-29 23:35:07
