date,username,to,retweets,text,mentions,permalink,is Noise,clean text,text length,is null,pos_count,neg_count,related?,sentiment,system_count,services_count,reason,Date_Time
2019-12-17 16:42:29,MuhanedID,INTERCEPTOR_JED,0,للاسف اسوء بنك في السعوديه هو الراجحي @alrajhibank_en ...وشي آخر انهم من اربح البنوك في السعوديه وما افتكر ان لهم اي مشاريع اللي تساعد او Give back to the communities ... في ستة أشهر فقط هاذي ارباحهم.. https://twitter.com/Moe74198110/status/1206977020720107521/photo/1,@alrajhibank_en,https://twitter.com/MuhanedID/status/1206977977277276160,not noise,لاسف اسوء بنك في السعوديه هو الراجحي وشي اخر انهم من اربح البنوك في السعوديه وما افتكر ان لهم اي مشاريع الي تساعد او Give back to the comunities في سته اشهر فقط هاذي ارباحهم,174,not null,0,1,related,negative,0,0,else,2019-12-17 16:42:29
2019-11-01 18:11:39,dhouom77,Not given,0,اسوء بنك موجود في السعوديه #قاطعوا_مصرف_الراجحي,Not given,https://twitter.com/dhouom77/status/1190330577825734656,not noise,اسوء بنك موجود في السعوديه قاطعوامصرفالراجحي,44,not null,0,1,related,negative,0,0,else,2019-11-01 18:11:39
2019-09-19 13:26:05,osamah3343,Not given,0,كل البنوك سيئين #الراجحي_أسوء_بنك_في_السعودية,Not given,https://twitter.com/osamah3343/status/1174676033880154112,not noise,كل البنوك سيئين الراجحياسوءبنكفيالسعوديه,40,not null,0,3,related,negative,0,0,else,2019-09-19 13:26:05
2019-09-15 13:02:36,abdulla_nofal,Not given,0,#الراجحي_أسوء_بنك_في_السعودية مع,Not given,https://twitter.com/abdulla_nofal/status/1173220570420432896,not noise,الراجحياسوءبنكفيالسعوديه مع,27,not null,0,1,related,neutral,0,0,else,2019-09-15 13:02:36
2019-06-29 20:11:06,taheroraibi115,AlRajhiBank,0,اسوء بنك الان في السعوديه اسدد القرض وغادر منه وكسر جميع صرفاته,Not given,https://twitter.com/taheroraibi115/status/1145062155915599872,not noise,اسوء بنك الان في السعوديه اسد القرض وغادر منه وكسر جميع صرفاته,62,not null,0,1,related,negative,0,0,else,2019-06-29 20:11:06
2019-05-19 12:21:36,skyguard61,AlRajhiBank,0,اسوء بنك في السعودية ويمكن في العالم اجمع. اهربوا بعيد عنه قدر استطاعتكم,Not given,https://twitter.com/skyguard61/status/1130086098112323584,not noise,اسوء بنك في السعوديه ويمكن في العالم اجمع اهربوا بعيد عنه قدر استطاعتكم,71,not null,0,1,related,negative,0,0,else,2019-05-19 12:21:36
2019-01-27 15:36:40,grm91,Not given,1,@AlRajhiBank تطبيقكم معلق كالعاده اسوء بنك في السعوديه,@AlRajhiBank,https://twitter.com/grm91/status/1089547745734610944,not noise,تطبيقكم معلق كالعاده اسوء بنك في السعوديه,42,not null,0,2,related,negative,0,0,else,2019-01-27 15:36:40
2017-02-12 13:05:55,FahedH_,Not given,0,@AlRajhiBank اسوء بنك في #السعوديه بنك الراجحي @HRCSaudi ترا هذول بشر اللي يراجعون شوي حقوق لهم,@AlRajhiBank @HRCSaudi,https://twitter.com/FahedH_/status/830764874032517120,not noise,اسوء بنك في السعوديه بنك الراجحي ترا هذول بشر الي يراجعون شوي حقوق لهم,71,not null,0,1,related,negative,0,0,else,2017-02-12 13:05:55
2017-01-09 17:58:28,OmarBiK11,Not given,2,#مسنه_بنك_الراجحي_بعرعر من خلال تجربة #بنك_الراجحي ي أسوء بنك في السعودية !!,Not given,https://twitter.com/OmarBiK11/status/818517311112052737,not noise,مسنهبنكالراجحيبعرعر من خلال تجربه بنكالراجحي ي اسوء بنك في السعوديه,68,not null,0,1,related,neutral,0,0,else,2017-01-09 17:58:28
2017-01-03 13:48:20,kareemzxzu,Not given,0,#مصرف_الراجحي اسوء مصرف في السعوديه الراجحي افضل مصرف وهو بنك الرياض,Not given,https://twitter.com/kareemzxzu/status/816280034138849280,not noise,مصرفالراجحي اسوء مصرف في السعوديه الراجحي افضل مصرف وهو بنك الرياض,66,not null,1,1,related,neutral,0,0,else,2017-01-03 13:48:20
2016-07-29 21:33:31,lovetrin1,Not given,0,اسوء بنك في السعوديه #رايك_في_مصرف_الراجحي,Not given,https://twitter.com/lovetrin1/status/759139818672648193,not noise,اسوء بنك في السعوديه رايكفيمصرفالراجحي,38,not null,0,1,related,neutral,0,0,else,2016-07-29 21:33:31
2016-07-29 19:35:31,Reemksaa,Not given,0,#رايك_في_مصرف_الراجحي اختصار للحكي اسوء بنك بـ السعودية,Not given,https://twitter.com/Reemksaa/status/759110121704321024,not noise,رايكفيمصرفالراجحي اختصار لحكي اسوء بنك ب السعوديه,49,not null,0,1,related,negative,0,0,else,2016-07-29 19:35:31
2016-07-29 14:00:18,a77_abdulaziz,Not given,14,#رايك_في_مصرف_الراجحي اسوء بنك في السعودية و الخيارات كثيرة و على رأسهم بنك الانماء,Not given,https://twitter.com/a77_abdulaziz/status/759025762930491392,not noise,رايكفيمصرفالراجحي اسوء بنك في السعوديه و الخيارات كثيره و علي راسهم بنك الانماء,79,not null,0,1,related,negative,0,0,else,2016-07-29 14:00:18
2016-06-29 21:29:19,weeabo966,Not given,0,بنك الراجحي اسوء بنك في السعودية رغم ان ثرواتهم بميليارات,Not given,https://twitter.com/weeabo966/status/748267123500257280,not noise,بنك الراجحي اسوء بنك في السعوديه رغم ان ثرواتهم بميليارات,57,not null,0,1,related,negative,0,0,else,2016-06-29 21:29:19
2016-06-15 3:56:43,amr9114,Not given,1,#اسوا_بنك_في_رايك وهل يخفى القمر بكل تاكيد مصرف الراجحي من اسوء البنوك السعودية من دون منافس له,Not given,https://twitter.com/amr9114/status/742928798778298373,not noise,اسوابنكفيرايك وهل يخفي القمر بكل تاكيد مصرف الراجحي من اسوء البنوك السعوديه من دون منافس له,91,not null,0,1,related,negative,0,0,else,2016-06-15 03:56:43
2016-05-18 9:40:14,strongdivel,AlRajhiBank,1,اسوء خدمات في السعوديه بنك الراجحي راتبي ينزل عندكم من خمسه سنين وجيت ابغى اطلع قالوا الشركة مو متعاقده معانا طيب وحق العشره,Not given,https://twitter.com/strongdivel/status/732868389182509056,not noise,اسوء خدمات في السعوديه بنك الراجحي راتبي ينزل عندكم من خمسه سنين وجيت ابغي اطلع قالوا الشركه مو متعاقده معانا طيب وحق العشره,124,not null,0,1,related,negative,0,0,else,2016-05-18 09:40:14
2016-01-17 9:28:58,Joudista,Not given,0,@AlRajhiBank قمة التخلف في هذا البنك اللي دائماً يثبت لي انه اسوء بنك في السعودية، وقت الصلاة يتقفل الباب ويمنع الدخول ماختلفنا ولكن ..يتبع,@AlRajhiBank,https://twitter.com/Joudista/status/688654231721631744,not noise,قمه التخلف في هذا البنك الي دائماً يثبت لي انه اسوء بنك في السعوديه وقت الصلاه يتقفل الباب ويمنع الدخول ماختلفنا ولكن يتبع,123,not null,0,1,related,negative,0,0,else,2016-01-17 09:28:58
2015-09-10 12:45:30,duna88999,asalwafe,0,@asalwafe @altuwaim_s اسوء بنك في السعودية الراجحي في جميع فروعه اذا تبي بنك اسلامي ( الانماء - البلاد ),@asalwafe @altuwaim_s,https://twitter.com/duna88999/status/641955659521507328,not noise,اسوء بنك في السعوديه الراجحي في جميع فروعه اذا تبي بنك اسلامي الانماء البلاد,78,not null,2,1,related,neutral,0,0,else,2015-09-10 12:45:30
2015-06-11 14:19:20,HASSAN_ALRUBEI,Not given,0,غيرة المنافسين من الراجحي ولاكن نقول القافلة تسير والكلاب تنبح #الراجحي_أسوء_بنك_في_السعودية,Not given,https://twitter.com/HASSAN_ALRUBEI/status/609001974164406272,not noise,غيره المنافسين من الراجحي ولاكن نقول القافله تسير والكلاب تنبح الراجحياسوءبنكفيالسعوديه,87,not null,0,1,related,negative,0,0,else,2015-06-11 14:19:20
2015-06-11 14:18:11,HASSAN_ALRUBEI,Not given,0,تاريخ بنك البلاد بتاريخ احد فروع الراجحي #الراجحي_أسوء_بنك_في_السعودية,Not given,https://twitter.com/HASSAN_ALRUBEI/status/609001688775561216,not noise,تاريخ بنك البلاد بتاريخ احد فروع الراجحي الراجحياسوءبنكفيالسعوديه,65,not null,0,1,related,neutral,0,0,else,2015-06-11 14:18:11
2015-06-10 19:04:08,asa99mmm,Not given,0,#الراجحي_يقطع_راتب_عسكري ليست بغريبة على الراجحي،الراجحي أسوء بنك في السعودية.,Not given,https://twitter.com/asa99mmm/status/608711262646620161,not noise,الراجحيقطعراتبعسكري ليست بغريبه علي الراجحيالراجحي اسوء بنك في السعوديه,71,not null,0,1,related,negative,0,0,else,2015-06-10 19:04:08
2015-06-10 18:15:53,mneef3,Not given,0,#الراجحي_أسوء_بنك_في_السعودية بعد مخالفة امر الملك وبأعتراف منهم بالبيان يزيدون الطين بله بكشف اسرار عميل ويقولون عنده حساب ثاني وش دخلكم!,Not given,https://twitter.com/mneef3/status/608699117565411328,not noise,الراجحياسوءبنكفيالسعوديه بعد مخالفه امر الملك وباعتراف منهم بالبيان يزيدون الطين بله بكشف اسرار عميل ويقولون عنده حساب ثاني وش دخلكم,132,not null,0,1,related,negative,0,0,else,2015-06-10 18:15:53
2015-06-09 16:42:54,ALharbi_naser1,AlRajhiBank,0,@AlRajhiBank هذا الي طلع منكم #الراجحي_يقطع_راتب_عسكري #الراجحي_أسوء_بنك_في_السعودية https://youtu.be/XUbZPiTq4XQ,@AlRajhiBank,https://twitter.com/ALharbi_naser1/status/608313330109923328,not noise,هذا الي طلع منكم الراجحيقطعراتبعسكري الراجحياسوءبنكفيالسعوديه,63,not null,0,1,related,negative,0,0,else,2015-06-09 16:42:54
2015-05-14 13:21:50,malharbi55,Not given,0,اتعس واخس بنك اللي لازم تراجعه اكثر من مره عشان تخلص لك شغله وحده بس #الراجحي #الراجحي_أسوء_بنك_في_السعودية,Not given,https://twitter.com/malharbi55/status/598840645902467072,not noise,اتعس واخس بنك الي لازم تراجعه اكثر من مره عشان تخلص لك شغله وحده بس الراجحي الراجحياسوءبنكفيالسعوديه,100,not null,0,1,related,negative,0,0,else,2015-05-14 13:21:50
2015-05-11 21:27:38,sdht20,Not given,0,بنك الراجحي لن يتأدب الا بمقاطعة توصل له فكرة انه ليس البنك الوحيد في السعودية #الراجحي_أسوء_بنك_في_السعودية,Not given,https://twitter.com/sdht20/status/597875736590954496,not noise,بنك الراجحي لن يتادب الا بمقاطعه توصل له فكره انه ليس البنك الوحيد في السعوديه الراجحياسوءبنكفيالسعوديه,103,not null,0,1,related,negative,0,0,else,2015-05-11 21:27:38
2015-04-19 14:56:33,Z3eem_Raeg,Not given,0,بنك الراجحي اسوء بنك في السعوديه #فصل_موظف_الراجحي,Not given,https://twitter.com/Z3eem_Raeg/status/589804786423201792,not noise,بنك الراجحي اسوء بنك في السعوديه فصلموظفالراجحي,47,not null,0,1,related,neutral,0,0,else,2015-04-19 14:56:33
2015-02-13 15:40:10,Hsn_Al_Qahtani,HussainMohamd,0,@HussainMohamd @AlRajhiBank من واقع تجربة اسوء بنك في المملكة العربية السعودية اذا استطعت ان تهرب منه ففعل.,@HussainMohamd @AlRajhiBank,https://twitter.com/Hsn_Al_Qahtani/status/566260550540095489,not noise,من واقع تجربه اسوء بنك في الملكه العربيه السعوديه اذا استطعت ان تهرب منه فعل,77,not null,0,1,related,negative,0,0,else,2015-02-13 15:40:10
2015-01-10 19:49:09,RoO7i1,Not given,1,الراجحي فشل يتعدى الحدود #الراجحي_أسوء_بنك_في_السعودية,Not given,https://twitter.com/RoO7i1/status/554002020403650561,not noise,الراجحي فشل يتعدي الحدود الراجحياسوءبنكفيالسعوديه,49,not null,0,2,related,negative,0,0,else,2015-01-10 19:49:09
2015-01-08 8:01:31,F_SaudK,Not given,1,اكككره تعقيدات خدماتهم و كل شي فيهم #الراجحي_أسوء_بنك_في_السعودية,Not given,https://twitter.com/F_SaudK/status/553099164507070464,not noise,اكره تعقيدات خدماتهم و كل شي فيهم الراجحياسوءبنكفيالسعوديه,58,not null,0,2,related,negative,0,0,else,2015-01-08 08:01:31
2014-11-30 6:53:24,DonNabil,Not given,0,#بنك_الراجحي من اسوء البنوك كخدمات في السعودية سيئ سيئ لأبعد درجة .. انظمة غريبه ومن جرف لدحديرة كيف كانت وكيف صارت يمدحون #بنك_الرياض,Not given,https://twitter.com/DonNabil/status/538948897255616513,not noise,بنكالراجحي من اسوء البنوك كخدمات في السعوديه سيئ سيئ لابعد درجه انظمه غريبه ومن جرف لدحديره كيف كانت وكيف صارت يمدحون بنكالرياض,127,not null,1,2,related,negative,0,0,else,2014-11-30 06:53:24
2014-07-25 23:52:28,SalehRbea,Not given,0,#الراجحي_أسوء_بنك_في_السعودية ماهي غريبة..متاجرة بالدين,Not given,https://twitter.com/SalehRbea/status/492819703488712704,not noise,الراجحياسوءبنكفيالسعوديه ماهي غريبهمتاجره بالدين,48,not null,0,1,related,negative,0,0,else,2014-07-25 23:52:28
2014-07-24 13:09:51,arefjazza,nayef965,0,@nayef965 @AlRajhiBank اي متميز يا بوجابر من أسوء البنوك في السعودية بنك غير مواكب للعصر,@nayef965 @AlRajhiBank,https://twitter.com/arefjazza/status/492295598876266497,not noise,اي متميز يا بوجابر من اسوء البنوك في السعوديه بنك غير مواكب لعصر,65,not null,0,1,related,positive,0,0,else,2014-07-24 13:09:51
2014-07-24 8:41:36,Sa3mr,Not given,1,#الراجحي_أسوء_بنك_في_السعودية حقيقة عايشتها اليوم,Not given,https://twitter.com/Sa3mr/status/492228089238142976,not noise,الراجحياسوءبنكفيالسعوديه حقيقه عايشتها اليوم,44,not null,0,1,related,negative,0,0,else,2014-07-24 08:41:36
2014-07-24 6:50:36,tnasser31,Not given,1,#الراجحي_أسوء_بنك_في_السعودية اكلم احد الاصدقاء قلت سوف ارفع شكوى ضدهم قال ،هذا بنك الراجحي لن تقدر ولن تستفيد اي شي فقد سوف تضيع وقتك!!,Not given,https://twitter.com/tnasser31/status/492200154607280128,not noise,الراجحياسوءبنكفيالسعوديه اكلم احد الاصدقاء قلت سوف ارفع شكوي ضدهم قال هذا بنك الراجحي لن تقدر ولن تستفيد اي شي فقد سوف تضيع وقتك,128,not null,0,1,related,negative,0,0,else,2014-07-24 06:50:36
2014-07-23 11:29:00,badrshfaqah,Not given,41," الفرع الخامس -شبرا ""نعتذر منك مافيه بطاقات"" @AlRajhiBank اليوم ماعندي شغل غير #الراجحي_أسوء_بنك_في_السعودية ^_^ ",@AlRajhiBank,https://twitter.com/badrshfaqah/status/491907827854635008,not noise,الفرع الخامس شبرا نعتذر منك مافيه بطاقات اليوم ماعندي شغل غير الراجحياسوءبنكفيالسعوديه,88,not null,0,1,related,neutral,0,0,else,2014-07-23 11:29:00
2014-07-23 11:08:15,badrshfaqah,Not given,10,وهذا الفرع الرابع 'الشميسي' لكن مافي موظف يصدر البطاقة ^_^ @AlRajhiBank صدق من قال #الراجحي_أسوء_بنك_في_السعودية,@AlRajhiBank,https://twitter.com/badrshfaqah/status/491902608223637504,not noise,وهذا الفرع الرابع الشميسي لكن مافي موظف يصدر البطاقه صدق من قال الراجحياسوءبنكفيالسعوديه,88,not null,0,1,related,negative,0,0,else,2014-07-23 11:08:15
2014-07-04 22:27:48,amalmal5,Not given,0,من كثر ما احول فلوس وجمعيات من حسابي كرهت بنك الراجحي ودي أغيره بس الإجراءات متعبه وتاخذ وقت #الراجحي_أسوء_بنك_في_السعودية,Not given,https://twitter.com/amalmal5/status/485188251011907585,not noise,من كثر ما احول فلوس وجمعيات من حسابي كرهت بنك الراجحي ودي اغيره بس الاجراءات متعبه وتاخذ وقت الراجحياسوءبنكفيالسعوديه,117,not null,0,1,related,negative,0,0,else,2014-07-04 22:27:48
2014-05-10 9:57:32,KrKrak94,Not given,0,#الراجحي_أسوء_بنك_في_السعودية بنك الراجحي افضل بنك من وجهة نظري وشكرا #بنك_الراجحي_أفضل_بنك_في_السعودية,Not given,https://twitter.com/KrKrak94/status/465068110030974976,not noise,الراجحياسوءبنكفيالسعوديه بنك الراجحي افضل بنك من وجه نظري وشكرا بنكالراجحيافضلبنكفيالسعوديه,91,not null,1,1,related,neutral,0,0,else,2014-05-10 09:57:32
2014-04-30 10:09:20,aak093x,Not given,1,بنك الراجحي أكبر بنك نصاب على مستوى العالم ّّرسوم إدارية 2290ريال والبنوك الأخرى 300ريال استغلال ألناس #الراجحي_أسوء_بنك_في_السعودية,Not given,https://twitter.com/aak093x/status/461447200242171904,not noise,بنك الراجحي اكبر بنك نصاب علي مستوي العالم ّرسوم اداريه 290ريال والبنوك الاخري 30ريال استغلال الناس الراجحياسوءبنكفيالسعوديه,124,not null,0,1,related,negative,0,0,else,2014-04-30 10:09:20
2014-04-26 10:51:16,3yad75,Not given,2,#الراجحي_أسوء_بنك_في_السعودية استغل عدم وجود شفافيه وامتص الفقرا من الشعب تحت حمايه من الفاسدين المنتفعين من مصاص الدما بنك #الراجحي,Not given,https://twitter.com/3yad75/status/460008200386138112,not noise,الراجحياسوءبنكفيالسعوديه استغل عدم وجود شفافيه وامتص الفقرا من الشعب تحت حمايه من الفاسدين المنتفعين من مصاص الدما بنك الراجحي,126,not null,0,1,related,negative,0,0,else,2014-04-26 10:51:16
2014-04-22 15:56:07,11samar,Not given,0,وانا ع ذلك من الشاهدين معاملتهم جداً سيئه #الراجحي_أسوء_بنك_في_السعودية,Not given,https://twitter.com/11samar/status/458635370117468160,not noise,وانا ع ذلك من الشاهدين معاملتهم جداً سيئه الراجحياسوءبنكفيالسعوديه,66,not null,0,2,related,negative,0,0,else,2014-04-22 15:56:07
2014-04-19 12:36:14,alwrraq,Not given,0,#الراجحي_أسوء_بنك_في_السعودية بنكالراجحي منشار نازل واكل طالع واكل ولا يرحم حتى الموتى,Not given,https://twitter.com/alwrraq/status/457497902211166208,not noise,الراجحياسوءبنكفيالسعوديه بنكالراجحي منشار نازل واكل طالع واكل ولا يرحم حتي الموتي,81,not null,0,1,related,negative,0,0,else,2014-04-19 12:36:14
2014-04-13 0:18:26,AlademiH,Not given,0,العربي اولا.. ثم الرياض.. ثم الاهلي ثم الراجحي #الراجحي_أسوء_بنك_في_السعودية,Not given,https://twitter.com/AlademiH/status/455137900192350208,not noise,العربي اولا ثم الرياض ثم الاهلي ثم الراجحي الراجحياسوءبنكفيالسعوديه,67,not null,0,1,related,negative,0,0,else,2014-04-13 00:18:26
2014-04-11 20:46:32,Mr_Almuhana,Not given,0,#الراجحي_أسوء_بنك_في_السعودية شي طبيعي راعية قصمنجي !!,Not given,https://twitter.com/Mr_Almuhana/status/454722189246226432,not noise,الراجحياسوءبنكفيالسعوديه شي طبيعي راعيه قصمنجي,47,not null,0,1,related,negative,0,0,else,2014-04-11 20:46:32
2014-04-10 10:36:21,iOsamaH28,Not given,0,صدق من قال البس يحب خناقه #الراجحي_أسوء_بنك_في_السعودية,Not given,https://twitter.com/iOsamaH28/status/454206240617689088,not noise,صدق من قال البس يحب خناقه الراجحياسوءبنكفيالسعوديه,50,not null,0,1,related,negative,0,0,else,2014-04-10 10:36:21
2014-04-10 10:35:57,iOsamaH28,Not given,0,ما أدري وش مصبركم على ذل هذا البنك ! #الراجحي_أسوء_بنك_في_السعودية,Not given,https://twitter.com/iOsamaH28/status/454206141271388161,not noise,ما ادري وش مصبركم علي ذل هذا البنك الراجحياسوءبنكفيالسعوديه,59,not null,0,1,related,negative,0,0,else,2014-04-10 10:35:57
2014-04-10 10:33:21,AbdA11h,Not given,1,موظفينهم بالواسطة ، متشخصين هذيك الشخصية والشعر طويل وحاط نظارات من زين الخشة. وبرا الددسن لونه وردي(: #الراجحي_أسوء_بنك_في_السعودية,Not given,https://twitter.com/AbdA11h/status/454205487249367040,not noise,موظفينهم بالواسطه متشخصين هذيك الشخصيه والشعر طويل وحاط نظارات من زين الخشه وبرا الدسن لونه وردي الراجحياسوءبنكفيالسعوديه,121,not null,0,1,related,negative,0,0,else,2014-04-10 10:33:21
2014-04-10 10:22:55,AbdA11h,Not given,0,جنبي زميلي يسال وش افضل بنك وهو بالراجحي وأنصحه منه ان يتركها ويروح للأهلي. والحمدلله جاء الهشتاق في وقته #الراجحي_أسوء_بنك_في_السعودية,Not given,https://twitter.com/AbdA11h/status/454202860172214272,not noise,جنبي زميلي يسال وش افضل بنك وهو بالراجحي وانصحه منه ان يتركها ويروح لاهلي والحمدله جاء الهشتاق في وقته الراجحياسوءبنكفيالسعوديه,127,not null,1,1,related,neutral,0,0,else,2014-04-10 10:22:55
2014-04-09 7:44:24,aaalmulaifi,Not given,0,حرامي الشريعة #الراجحي_أسوء_بنك_في_السعودية,Not given,https://twitter.com/aaalmulaifi/status/453800581539581952,not noise,حرامي الشريعه الراجحياسوءبنكفيالسعوديه,38,not null,0,1,related,negative,0,0,else,2014-04-09 07:44:24
2014-04-09 6:37:31,ha1416ha,Not given,0,صرافات المهد بلا فلوس لاأبوه من بنك #الراجحي_أسوء_بنك_في_السعودية,Not given,https://twitter.com/ha1416ha/status/453783750720360448,not noise,صرافات المهد بلا فلوس لابوه من بنك الراجحياسوءبنكفيالسعوديه,59,not null,0,1,related,negative,0,0,else,2014-04-09 06:37:31
2014-04-09 5:07:36,9_Sally,Not given,0,#الراجحي_أسوء_بنك_في_السعودية مااظنه اسوأ من الاهلي اللي كل فتره لازم تحديث للبيانات ولا يجمدون الحساب وجع,Not given,https://twitter.com/9_Sally/status/453761119682052098,not noise,الراجحياسوءبنكفيالسعوديه ماظنه اسوا من الاهلي الي كل فتره لازم تحديث لبيانات ولا يجمدون الحساب وجع,98,not null,0,1,related,negative,0,0,else,2014-04-09 05:07:36
2014-04-09 3:33:45,Maazi4,YAYAQ2011,1,@YAYAQ2011 المواطنون يمشون على انه اسلامي و هو حوش كلاب مسعورة ... #الراجحي_أسوء_بنك_في_السعودية,@YAYAQ2011,https://twitter.com/Maazi4/status/453737502914785280,not noise,المواطنون يمشون علي انه اسلامي و هو حوش كلاب مسعوره الراجحياسوءبنكفيالسعوديه,77,not null,0,1,related,negative,0,0,else,2014-04-09 03:33:45
2014-04-09 3:18:23,Maazi4,Not given,0,#الراجحي_أسوء_بنك_في_السعودية حرامي ما يستحي و فوق القانون ينطبق على عميله مثال ( ططططط ) و متروش بقربتها,Not given,https://twitter.com/Maazi4/status/453733638186627072,not noise,الراجحياسوءبنكفيالسعوديه حرامي ما يستحي و فوق القانون ينطبق علي عميله مثال ط و متروش بقربتها,92,not null,0,1,related,negative,0,0,else,2014-04-09 03:18:23
