date,username,to,retweets,text,mentions,permalink,is Noise,clean text,text length,is null,pos_count,neg_count,related?,sentiment,system_count,services_count,reason,Date_Time
2019-11-01 22:49:25,uWNpgh6m7KnFLxZ,Not given,0,#قاطعوا_مصرف_الراجحي اي من كثر الفلوس اللي بالحساب كل ابوها ١٧ ريال,Not given,https://twitter.com/uWNpgh6m7KnFLxZ/status/1190400478875701251,not noise,قاطعوامصرفالراجحي اي من كثر الفلوس الي بالحساب كل ابوها ١٧ ريال,63,not null,0,0,related,negative,0,0,else,2019-11-01 22:49:25
2019-11-01 22:48:58,PLK2cfRe9hxSVHf,Not given,0,#قاطعوا_مصرف_الراجحي طيب حساب مواطن ينزل على الراجحى,Not given,https://twitter.com/PLK2cfRe9hxSVHf/status/1190400365763710976,not noise,قاطعوامصرفالراجحي طيب حساب مواطن ينزل علي الراجحي,49,not null,0,0,related,neutral,0,0,else,2019-11-01 22:48:58
2019-11-01 22:48:41,Samiya_Bakhsh,Not given,0,#قاطعوا_مصرف_الراجحي وملاييني وين احطهم,Not given,https://twitter.com/Samiya_Bakhsh/status/1190400292904419328,not noise,قاطعوامصرفالراجحي وملايني وين احطهم,35,not null,0,0,related,negative,0,0,else,2019-11-01 22:48:41
2019-11-01 22:48:32,N141422,Not given,0,#قاطعوا_مصرف_الراجحي ممكن مشاهدة الفيديو,Not given,https://twitter.com/N141422/status/1190400256472694784,not noise,قاطعوامصرفالراجحي مكن مشاهده الفيديو,36,not null,0,0,related,neutral,0,0,else,2019-11-01 22:48:32
2019-11-01 22:48:31,masf98,Not given,1,شكل التاق برعاية البنك الأهلي #قاطعوا_مصرف_الراجحي,Not given,https://twitter.com/masf98/status/1190400254224609280,not noise,شكل التاق برعايه البنك الاهلي قاطعوامصرفالراجحي,47,not null,0,0,related,neutral,0,0,else,2019-11-01 22:48:31
2019-11-01 22:48:21,hffiurrlkkhgbhu,Not given,0,#قاطعوا_مصرف_الراجحي وفلوسي وين الوديها,Not given,https://twitter.com/hffiurrlkkhgbhu/status/1190400210222141440,not noise,قاطعوامصرفالراجحي وفلوسي وين الوديها,36,not null,0,0,related,negative,0,0,else,2019-11-01 22:48:21
2019-11-01 22:48:07,aldossri08,Not given,0,قابلت واحد من اخوياي قالي جعلني قبلك ، قلت ،، امين وزعل هههههههههههههههههههههههههه #قاطعوا_مصرف_الراجحي,Not given,https://twitter.com/aldossri08/status/1190400152466599938,not noise,قابلت واحد من اخوياي قالي جعلني قبلك قلت امين وزعل ه قاطعوامصرفالراجحي,70,not null,0,0,related,negative,0,0,else,2019-11-01 22:48:07
2019-11-01 22:47:40,yalsalmah,Not given,0,مصرف الراجحي افضل مصرف ليس بالسعوديه فقط بل على مستوى العالم يملك افضل خدمات الكترونيه ويقارع افضل البنوك العالميه #قاطعوا_مصرف_الراجحي,Not given,https://twitter.com/yalsalmah/status/1190400039551676418,not noise,مصرف الراجحي افضل مصرف ليس بالسعوديه فقط بل علي مستوي العالم يملك افضل خدمات الكترونيه ويقارع افضل البنوك العالميه قاطعوامصرفالراجحي,132,not null,1,0,related,positive,0,0,else,2019-11-01 22:47:40
2019-11-01 22:46:32,som_609,Not given,0,#قاطعوا_مصرف_الراجحي لبن هو نقاطعه !,Not given,https://twitter.com/som_609/status/1190399752480985091,not noise,قاطعوامصرفالراجحي لبن هو نقاطعه,32,not null,0,0,related,negative,0,0,else,2019-11-01 22:46:32
2019-11-01 22:45:57,l717i,Not given,0,#قاطعوا_مصرف_الراجحي حتى عروضهم مثل وجيههم,Not given,https://twitter.com/l717i/status/1190399605344743424,not noise,قاطعوامصرفالراجحي حتي عروضهم مثل وجيهم,38,not null,0,0,related,negative,0,0,else,2019-11-01 22:45:57
2019-11-01 22:45:33,basoomah2556,Not given,0,هشتاق وترند ومافي شي يوضح ايش السبب#قاطعوا_مصرف_الراجحي,Not given,https://twitter.com/basoomah2556/status/1190399505394475010,not noise,هشتاق وترند ومافي شي يوضح ايش السبقاطعوامصرفالراجحي,51,not null,0,0,related,negative,0,0,else,2019-11-01 22:45:33
2019-11-01 22:44:17,d_sa01,Not given,0,#قاطعوا_مصرف_الراجحي,Not given,https://twitter.com/d_sa01/status/1190399189122990080,not noise,قاطعوامصرفالراجحي,17,not null,0,0,related,neutral,0,0,else,2019-11-01 22:44:17
2019-11-01 22:44:06,ranih2019,M78AKH,0,#قاطعوا_مصرف_الراجحي فعلا من أسوأ المصارف في العالم مصرف الراجحي والكل عانى منهم ولا زال يعاني من كثرة الأعطال في المصرف,Not given,https://twitter.com/ranih2019/status/1190399141203136517,not noise,قاطعوامصرفالراجحي فعلا من اسوا المصارف في العالم مصرف الراجحي والكل عاني منهم ولا زال يعاني من كثره الاعطال في المصرف,117,not null,0,0,related,negative,0,0,else,2019-11-01 22:44:06
2019-11-01 22:43:52,y34502,Not given,0,#قاطعوا_مصرف_الراجحي شسالفه,Not given,https://twitter.com/y34502/status/1190399083254599685,not noise,قاطعوامصرفالراجحي شسالفه,24,not null,0,0,related,negative,0,0,else,2019-11-01 22:43:52
2019-11-01 22:43:10,nasser302015,Not given,0,تم #قاطعوا_مصرف_الراجحي,Not given,https://twitter.com/nasser302015/status/1190398907932708869,not noise,تم قاطعوامصرفالراجحي,20,not null,0,0,related,neutral,0,0,else,2019-11-01 22:43:10
2019-11-01 22:42:45,Sala7Khalide,Not given,0,افضل مصرف شفته للامانة خدمته ممتازة #قاطعوا_مصرف_الراجحي,Not given,https://twitter.com/Sala7Khalide/status/1190398802701799424,not noise,افضل مصرف شفته لامانه خدمته متازه قاطعوامصرفالراجحي,51,not null,1,0,related,positive,0,0,else,2019-11-01 22:42:45
2019-11-01 22:42:30,26_torky,Not given,0,#قاطعوا_مصرف_الراجحي زبادي هو,Not given,https://twitter.com/26_torky/status/1190398739200000001,not noise,قاطعوامصرفالراجحي زبادي هو,26,not null,0,0,related,neutral,0,0,else,2019-11-01 22:42:30
2019-11-01 22:42:13,Abdulla15957029,Not given,0,الحمد لله اخذت قرض من البنك العربي بنسبه ١.٦٥ والراححي طالب نسبه ٦.٤ سرق عيني عينك #قاطعوا_مصرف_الراجحي,Not given,https://twitter.com/Abdulla15957029/status/1190398667523530754,not noise,الحمد له اخذت قرض من البنك العربي بنسبه ١٦٥ والراحي طالب نسبه ٦٤ سرق عيني عينك قاطعوامصرفالراجحي,96,not null,0,0,related,negative,0,0,else,2019-11-01 22:42:13
2019-11-01 22:41:21,ax_8228,Not given,0,اشوى حسابي ماتقفل وراحت ملاييني #قاطعوا_مصرف_الراجحي,Not given,https://twitter.com/ax_8228/status/1190398448933228544,not noise,اشوي حسابي ماتقفل وراحت ملايني قاطعوامصرفالراجحي,48,not null,0,0,related,negative,0,0,else,2019-11-01 22:41:21
2019-11-01 22:41:19,mather_nr,Not given,0,#قاطعوا_مصرف_الراجحي,Not given,https://twitter.com/mather_nr/status/1190398439672229889,not noise,قاطعوامصرفالراجحي,17,not null,0,0,related,neutral,0,0,else,2019-11-01 22:41:19
2019-11-01 22:40:31,schols_,Not given,0,#قاطعوا_مصرف_الراجحي من وين لهم فلوس يصورونها بالعيد بعدين احس حزنت,Not given,https://twitter.com/schols_/status/1190398239100604419,not noise,قاطعوامصرفالراجحي من وين لهم فلوس يصورونها بالعيد بعدين احس حزنت,64,not null,0,0,related,negative,0,0,else,2019-11-01 22:40:31
2019-11-01 22:39:58,Mhpob2,M78AKH,0,#قاطعوا_مصرف_الراجحي مو بس اسوأ الا في غاية السؤ .. يُجمد حسابي بدون سبب قوي وبدون اي حق .. بس ريحت راسي وقفلته نهائي هم الكسبانين اولاً واخيراً من كل ريال يدخل حساباتنا او يطلع وحنا فاغرين نجمع عندهم .. ويجب مقاطعتهم تأديب ..,Not given,https://twitter.com/Mhpob2/status/1190398103117008898,not noise,قاطعوامصرفالراجحي مو بس اسوا الا في غايه السؤ يُجمد حسابي بدون سب قوي وبدون اي حق بس ريحت راسي وقفلته نهائي هم الكسبانين اولاً واخيراً من كل ريال يدخل حساباتنا او يطلع وحنا فاغرين نجمع عندهم ويجب مقاطعتهم تاديب,211,not null,0,0,related,negative,0,0,else,2019-11-01 22:39:58
2019-11-01 22:39:54,_xfahad1,Not given,0,انا اشوفه افضل بنك وما أتوقع أغيره ابد .. #قاطعوا_مصرف_الراجحي,Not given,https://twitter.com/_xfahad1/status/1190398083181547520,not noise,انا اشوفه افضل بنك وما اتوقع اغيره ابد قاطعوامصرفالراجحي,56,not null,1,0,related,positive,0,0,else,2019-11-01 22:39:54
2019-11-01 22:39:46,mfh0071,Not given,0,فتحت حساب في اكثر من بنك بس للاسف ما ارتحت الا مع الراجحي ارزاق #قاطعوا_مصرف_الراجحي,Not given,https://twitter.com/mfh0071/status/1190398052131061765,not noise,فتحت حساب في اكثر من بنك بس لاسف ما ارتحت الا مع الراجحي ارزاق قاطعوامصرفالراجحي,80,not null,0,0,related,negative,0,0,else,2019-11-01 22:39:46
2019-11-01 22:39:43,i2_h,Not given,1,#قاطعوا_مصرف_الراجحي يوم اخذت منهم قرض تقولون قاطعوا !!! وينكم قبل اربع ايام !؟ عيب اللي قاعد يصير ياخوان,Not given,https://twitter.com/i2_h/status/1190398037123883008,not noise,قاطعوامصرفالراجحي يوم اخذت منهم قرض تقولون قاطعوا وينكم قبل اربع ايام عيب الي قاعد يصير ياخوان,94,not null,0,0,related,negative,0,0,else,2019-11-01 22:39:43
2019-11-01 22:39:35,layal09599501,M78AKH,0,صراحه اسلوب التعامل كأنو البنك الوحيد في المملكه بجد الناس م تستعبدوها يعني ايقاف خدمات وانفك بس باقي البنك يماطل مافتح الحساب كل يوم يقولون تعال بعد يومين واخرتها خذ ستين الف اسحبها وارجع رجعها والا بنسوي بلاغ وهي فلوسه رواتبه اللي تجمعت بسب الايقاف ..يتبع #قاطعوا_مصرف_الراجحي,Not given,https://twitter.com/layal09599501/status/1190398005649780741,not noise,صراحه اسلوب التعامل كانو البنك الوحيد في الملكه بجد الناس م تستعبدوها يعني ايقاف خدمات وانفك بس باقي البنك يماطل مافتح الحساب كل يوم يقولون تعال بعد يومين واخرتها خذ ستين الف اسحبها وارجع رجعها والا بنسوي بلاغ وهي فلوسه رواتبه الي تجمعت بسب الايقاف يتبع قاطعوامصرفالراجحي,271,not null,0,0,related,negative,1,1,else,2019-11-01 22:39:35
2019-11-01 22:39:25,NxaAnbCa6QCpomN,Not given,0,#قاطعوا_مصرف_الراجحي والملايين الي عندي وين أوديها ..,Not given,https://twitter.com/NxaAnbCa6QCpomN/status/1190397960686841857,not noise,قاطعوامصرفالراجحي والملاين الي عندي وين اوديها,47,not null,0,0,related,negative,0,0,else,2019-11-01 22:39:25
2019-11-01 22:39:08,__iir07,Not given,0,وفلوسي طيب #قاطعوا_مصرف_الراجحي,Not given,https://twitter.com/__iir07/status/1190397891984183297,not noise,وفلوسي طيب قاطعوامصرفالراجحي,28,not null,0,0,related,negative,0,0,else,2019-11-01 22:39:08
2019-11-01 22:39:04,pjlgc_,Not given,0,اعطيكم رقم حسابي م فيه ازين من الراجحي ؟ #قاطعوا_مصرف_الراجحي,Not given,https://twitter.com/pjlgc_/status/1190397874703605760,not noise,اعطيكم رقم حسابي م فيه ازين من الراجحي قاطعوامصرفالراجحي,56,not null,0,0,related,neutral,0,0,else,2019-11-01 22:39:04
2019-11-01 22:38:02,ALQHTANIhmad,Not given,0,اذا بتقاطعو الراجحي حولو فلوسكم علي وشكراً #قاطعوا_مصرف_الراجحي,Not given,https://twitter.com/ALQHTANIhmad/status/1190397614929403904,not noise,اذا بتقاطعو الراجحي حولو فلوسكم علي وشكراً قاطعوامصرفالراجحي,60,not null,0,0,related,negative,0,0,else,2019-11-01 22:38:02
2019-11-01 22:37:52,hkuuabC6WNT1yBn,Not given,0,#قاطعوا_مصرف_الراجحي تغطيه جميع مزادات الصنف واسواق الحلال,Not given,https://twitter.com/hkuuabC6WNT1yBn/status/1190397573389045761,not noise,قاطعوامصرفالراجحي تغطيه جميع مزادات الصنف واسواق الحلال,55,not null,0,0,related,neutral,0,0,else,2019-11-01 22:37:52
2019-11-01 22:37:42,zooz51894034,Not given,0,#قاطعوا_مصرف_الراجحي. “,Not given,https://twitter.com/zooz51894034/status/1190397529596276736,not noise,قاطعوامصرفالراجحي,18,not null,0,0,related,neutral,0,0,else,2019-11-01 22:37:42
2019-11-01 22:37:28,admntk74,Not given,0,#قاطعوا_مصرف_الراجحي,Not given,https://twitter.com/admntk74/status/1190397471891099648,not noise,قاطعوامصرفالراجحي,17,not null,0,0,related,neutral,0,0,else,2019-11-01 22:37:28
2019-11-01 22:37:20,iiosh3,Not given,0,#قاطعوا_مصرف_الراجحي الملايين حقتي كلها فيه كيف اقاطعه,Not given,https://twitter.com/iiosh3/status/1190397438907092992,not noise,قاطعوامصرفالراجحي الملاين حقتي كلها فيه كيف اقاطعه,50,not null,0,0,related,negative,0,0,else,2019-11-01 22:37:20
2019-11-01 22:37:04,m_ash3eir,Not given,0,ابشركم مقاطعته من ٥ سنوات #قاطعوا_مصرف_الراجحي,Not given,https://twitter.com/m_ash3eir/status/1190397371752046595,not noise,ابشركم مقاطعته من ٥ سنوات قاطعوامصرفالراجحي,43,not null,0,0,related,neutral,0,0,else,2019-11-01 22:37:04
2019-11-01 22:36:23,AnalkTop,Not given,0,#قاطعوا_مصرف_الراجحي من افضل البنوك عن تجربة..,Not given,https://twitter.com/AnalkTop/status/1190397198535725059,not noise,قاطعوامصرفالراجحي من افضل البنوك عن تجربه,41,not null,1,0,related,neutral,0,0,else,2019-11-01 22:36:23
2019-11-01 22:36:06,mooonab3,Not given,0,مصرف الراجحي من أفضل المصارف باالسعوديه. وجهةنظري#قاطعوا_مصرف_الراجحي,Not given,https://twitter.com/mooonab3/status/1190397126502764544,not noise,مصرف الراجحي من افضل المصارف بالسعوديه وجهنظريقاطعوامصرفالراجحي,63,not null,1,0,related,neutral,0,0,else,2019-11-01 22:36:06
2019-11-01 22:35:46,M00na_ff,Not given,0,وفلوسنا من يمسكها لنا #قاطعوا_مصرف_الراجحي,Not given,https://twitter.com/M00na_ff/status/1190397045615529986,not noise,وفلوسنا من يمسكها لنا قاطعوامصرفالراجحي,39,not null,0,0,related,negative,0,0,else,2019-11-01 22:35:46
2019-11-01 22:35:27,ragh_vu,ragh_vu,0,#قاطعوا_مصرف_الراجحي,Not given,https://twitter.com/ragh_vu/status/1190396965042970624,not noise,قاطعوامصرفالراجحي,17,not null,0,0,related,neutral,0,0,else,2019-11-01 22:35:27
2019-11-01 22:35:21,B19577768,Not given,0,#قاطعوا_مصرف_الراجحي,Not given,https://twitter.com/B19577768/status/1190396937398345728,not noise,قاطعوامصرفالراجحي,17,not null,0,0,related,neutral,0,0,else,2019-11-01 22:35:21
2019-11-01 22:34:45,AA71739813,Not given,0,#قاطعوا_مصرف_الراجحي موظف بنك الراجحي علاقته معك قبل القرض وبعد,Not given,https://twitter.com/AA71739813/status/1190396790039883776,not noise,قاطعوامصرفالراجحي موظف بنك الراجحي علاقته معك قبل القرض وبعد,60,not null,0,0,related,neutral,0,0,else,2019-11-01 22:34:45
2019-11-01 22:34:41,ABOSARA2017s,Not given,0,#قاطعوا_مصرف_الراجحي اقول تعوذو من الشيطان ونامو محد داري عنكم .وبعد ماهو شركه المراعي ع شان تقاطعونها هاذا بنك,Not given,https://twitter.com/ABOSARA2017s/status/1190396772872536066,not noise,قاطعوامصرفالراجحي اقول تعوذو من الشيطان ونامو محد داري عنكم وبعد ماهو شركه المراعي ع شان تقاطعونها هاذا بنك,107,not null,0,0,related,negative,0,0,else,2019-11-01 22:34:41
2019-11-01 22:34:09,fifi_itti,Not given,0,افااااااا ودراهمي وين احطهـا #قاطعوا_مصرف_الراجحي,Not given,https://twitter.com/fifi_itti/status/1190396636557709312,not noise,افا ودراهمي وين احطها قاطعوامصرفالراجحي,39,not null,0,0,related,negative,0,0,else,2019-11-01 22:34:09
2019-11-01 22:33:51,alialali_2016,Not given,0,#قاطعوا_مصرف_الراجحي,Not given,https://twitter.com/alialali_2016/status/1190396561844572160,not noise,قاطعوامصرفالراجحي,17,not null,0,0,related,neutral,0,0,else,2019-11-01 22:33:51
2019-11-01 22:33:33,prfij16,Not given,0,عطوني سبب مقنع يخليني اقاطع بنك مثل بنك الراجحي الراقي #قاطعوا_مصرف_الراجحي,Not given,https://twitter.com/prfij16/status/1190396486711992321,not noise,عطوني سب مقنع يخليني اقاطع بنك مثل بنك الراجحي الراقي قاطعوامصرفالراجحي,71,not null,0,0,related,negative,0,0,else,2019-11-01 22:33:33
2019-11-01 22:33:16,Qqio9,Not given,0,اشترو مديونيتنا يالبنوك الثانيه ونجي عندكم #قاطعوا_مصرف_الراجحي,Not given,https://twitter.com/Qqio9/status/1190396415576616961,not noise,اشترو مديونيتنا يالبنوك الثانيه ونجي عندكم قاطعوامصرفالراجحي,60,not null,0,0,related,negative,0,0,else,2019-11-01 22:33:16
2019-11-01 22:33:15,BJuo41zabuFN9dx,Not given,0,احلى مصرف عندي #قاطعوا_مصرف_الراجحي,Not given,https://twitter.com/BJuo41zabuFN9dx/status/1190396409176055810,not noise,احلي مصرف عندي قاطعوامصرفالراجحي,32,not null,0,0,related,positive,0,0,else,2019-11-01 22:33:15
2019-11-01 22:32:22,1434Bassem,Not given,0,#قاطعوا_مصرف_الراجحي,Not given,https://twitter.com/1434Bassem/status/1190396190250164224,not noise,قاطعوامصرفالراجحي,17,not null,0,0,related,neutral,0,0,else,2019-11-01 22:32:22
2019-11-01 22:32:09,ajlan_nahid,Not given,0,ابوي مايحبه ولا حتى يصرف من مكينته بس وش السالفه؟! #قاطعوا_مصرف_الراجحي,Not given,https://twitter.com/ajlan_nahid/status/1190396135208312832,not noise,ابوي مايحبه ولا حتي يصرف من مكينته بس وش السالفه قاطعوامصرفالراجحي,66,not null,0,0,related,negative,0,0,else,2019-11-01 22:32:09
2019-11-01 22:31:00,Nada_nfc10,Not given,0,ليعيشششش فلوسنا كلها بوه #قاطعوا_مصرف_الراجحي,Not given,https://twitter.com/Nada_nfc10/status/1190395842534035459,not noise,ليعيش فلوسنا كلها بوه قاطعوامصرفالراجحي,39,not null,0,0,related,negative,0,0,else,2019-11-01 22:31:00
2019-11-01 22:30:53,bbb_333_aaa,Not given,0,الرياض بطل #قاطعوا_مصرف_الراجحي,Not given,https://twitter.com/bbb_333_aaa/status/1190395814008541184,not noise,الرياض بطل قاطعوامصرفالراجحي,28,not null,0,0,related,neutral,0,0,else,2019-11-01 22:30:53
2019-11-01 22:30:22,silvadooooor,Not given,0,أخيراً يا بنك الراجحي أبغى فلوسي وأبغى حل لكل مشاكلي معكم وأبغى تعويض عن الضرر النفسي ومصالحي التي تعطلت بسببكم ! وأنتم يا عملاءالراجحي نصيحة بأعلى صوتي؛ #قاطعوا_مصرف_الراجحي,Not given,https://twitter.com/silvadooooor/status/1190395683431440384,not noise,اخيراً يا بنك الراجحي ابغي فلوسي وابغي حل لكل مشاكلي معكم وابغي تعويض عن الضر النفسي ومصالحي التي تعطلت بسبكم وانتم يا عملاءالراجحي نصيحه باعلي صوتي قاطعوامصرفالراجحي,166,not null,0,0,related,negative,1,1,else,2019-11-01 22:30:22
2019-11-01 22:30:16,abdullah93333,Not given,0,#قاطعوا_مصرف_الراجحي الحمدلله على نعمة بنك الأستثمار,Not given,https://twitter.com/abdullah93333/status/1190395661923049474,not noise,قاطعوامصرفالراجحي الحمدله علي نعمه بنك الاستثمار,48,not null,0,0,related,positive,0,0,else,2019-11-01 22:30:16
2019-11-01 22:29:56,3aBr_Gh7,Not given,0,المفروض بنك سامبا #قاطعوا_مصرف_الراجحي,Not given,https://twitter.com/3aBr_Gh7/status/1190395577386897411,not noise,المفروض بنك سامبا قاطعوامصرفالراجحي,35,not null,0,0,related,neutral,0,0,else,2019-11-01 22:29:56
2019-11-01 22:29:34,ma63356,Not given,0,#قاطعوا_مصرف_الراجحي اسكتو لا يزعلونا علينا,Not given,https://twitter.com/ma63356/status/1190395483451199489,not noise,قاطعوامصرفالراجحي اسكتو لا يزعلونا علينا,40,not null,0,0,related,negative,0,0,else,2019-11-01 22:29:34
2019-11-01 22:28:49,roojj3333,Not given,0,البنك الوحيد الي عندي حساب فية ومصفر . #قاطعوا_مصرف_الراجحي,Not given,https://twitter.com/roojj3333/status/1190395295751913472,not noise,البنك الوحيد الي عندي حساب فيه ومصفر قاطعوامصرفالراجحي,54,not null,0,0,related,neutral,0,0,else,2019-11-01 22:28:49
2019-11-01 22:28:37,fhokncz,Not given,0,#قاطعوا_مصرف_الراجحي,Not given,https://twitter.com/fhokncz/status/1190395246770900992,not noise,قاطعوامصرفالراجحي,17,not null,0,0,related,neutral,0,0,else,2019-11-01 22:28:37
2019-11-01 22:28:32,raboo2019,Not given,0,#قاطعوا_مصرف_الراجحي هو الافضل,Not given,https://twitter.com/raboo2019/status/1190395222959755264,not noise,قاطعوامصرفالراجحي هو الافضل,27,not null,1,0,related,positive,0,0,else,2019-11-01 22:28:32
2019-11-01 22:27:23,Htn565,Not given,0,#قاطعوا_مصرف_الراجحي اين الأعمال الخيريه التي يتبجح بها المصرف ونحن نعرف ان كل هذا هروب من الزكاة والضرائب,Not given,https://twitter.com/Htn565/status/1190394933577949184,not noise,قاطعوامصرفالراجحي اين الاعمال الخيريه التي يتبجح بها المصرف ونحن نعرف ان كل هذا هروب من الزكاه والضرائب,103,not null,0,0,related,negative,0,0,else,2019-11-01 22:27:23
2019-11-01 22:27:20,mahwiy,Not given,0,#قاطعوا_مصرف_الراجحي من زماااااان مقاطعته,Not given,https://twitter.com/mahwiy/status/1190394920592445440,not noise,قاطعوامصرفالراجحي من زمان مقاطعته,33,not null,0,0,related,negative,0,0,else,2019-11-01 22:27:20
2019-11-01 22:27:13,wa_le9,Not given,0,ختمت الحسابات فيه ماني مقاطعه احبه ياخي .. سهل مرره .. #قاطعوا_مصرف_الراجحي,Not given,https://twitter.com/wa_le9/status/1190394890703851521,not noise,ختمت الحسابات فيه ماني مقاطعه احبه ياخي سهل مره قاطعوامصرفالراجحي,65,not null,0,0,related,positive,0,0,else,2019-11-01 22:27:13
2019-11-01 22:26:53,muneera56m,Not given,0,#قاطعوا_مصرف_الراجحي وملياراتي وين احطها,Not given,https://twitter.com/muneera56m/status/1190394809904717825,not noise,قاطعوامصرفالراجحي وملياراتي وين احطها,37,not null,0,0,related,negative,0,0,else,2019-11-01 22:26:53
2019-11-01 22:26:23,al3eiza,Not given,0,تم #قاطعوا_مصرف_الراجحي,Not given,https://twitter.com/al3eiza/status/1190394683886833664,not noise,تم قاطعوامصرفالراجحي,20,not null,0,0,related,neutral,0,0,else,2019-11-01 22:26:23
2019-11-01 22:26:16,ashosha441,Not given,0,#قاطعوا_مصرف_الراجحي اخاف ياخذون فلوسي اللي عندهم، اذا افلست بقاطعهم^_*,Not given,https://twitter.com/ashosha441/status/1190394652748341251,not noise,قاطعوامصرفالراجحي اخاف ياخذون فلوسي الي عندهم اذا افلست بقاطعهم,63,not null,0,0,related,negative,0,0,else,2019-11-01 22:26:16
